Frequency,Offset,Tone,Call,Location,ST/PR,Use,VOIP,DGTL,Mi,Dir,,state_id,ID,Latitude,Longitude,Downlink,Uplink,Uplink Tone,Downlink Tone,County,Op Status,Coverage,Sponsor,Features,Coordination,Last update,DMR Enabled,Color Code,IPSC Network,Wide Network,Affiliate,Nets,Web links,D-STAR Enabled,Node,Sources,Grid,Notes,EchoLink,DMR ID,Talkgroups,Worldwide,North America,English,TAC 310,Local/Cluster,N. Colorado,Rocky Mountain Wide,Northern Colorado Regional,Links,Talkgroup Network,Worldwide English,DCI Bridge,Colorado,Commands,Mountain Reg USA,YSF Digital Enabled,DG-ID,Mixed-Mode,P-25 Digital Enabled,NAC,Default Reflector,IRLP,Bandwidth,Local Network,RX Location,Gunbarrel,Lousville,Lyons,Louisville #2,AllStar,Wyoming,WyLOCAL,On-air,Feed,WIRES-X,Southern Colorado,Central Regional,Devilshead Local,NXDN Enabled,RAN,NXDN Bandwidth,NXDN Network,Eastern Colorado,TAC 311,Colorado Chat,Location Photo
449.775,-5,CSQ,W0TX,"Lakewood, Green Mtn",CO,OPEN,,Y,62.48,S,,08,8215,39.68220139,-105.14299774,449.775,444.775,,,Jefferson,On-Air,Metro Denver,Denver Radio Club,Yaesu Digital Only,CCARC,2019-09-06,,,,,,,Denver Radio Club,,,,DM79KQ,"YSF digital only, no analog FM",,,,,,,,,,,,,,,,,,,yes,Open ↑ / Open ↓,,,,,,,,,,,,,,,,,,,,,,,,,,,,,
449.05,-5,107.2,WG0N,"Idaho Springs, Squaw Mountain",CO,OPEN,,,62.51,SSW,,08,95,39.74250031,-105.51399994,449.05,444.05,107.2,107.2,Denver,On-Air,Wide area.,WG0N,E-power.,CCARC,2012-11-20,,,,,,,,,,,DM79FR,,,,,,,,,,,,,,,,,,,,,,,,,,,,,,,,,,,,,,,,,,,,,,,,,,
447.85,-5,141.3,AC0KQ,"Evergreen, Saddleback Mountain",CO,OPEN,A,,62.75,SSW,,08,9580,39.71889877,-105.44000244,447.85,442.85,141.3,141.3,Clear Creek,Off-Air,Wide area at 9500',AC0KQ,AllStar node repeater providing wide area coverage along the Front Range,CCARC,2019-08-23,,,,,Rocky Mountain Ham Radio,,,,,,,,,,,,,,,,,,,,,,,,,,,,,,,,,,,,,,,,29571,,,,,,,,,,,,,,,,
449.15,-5,136.5,WR0AEN,Aurora,CO,OPEN,,S,63.08,SSE,,08,8207,39.69670105,-104.80999756,449.15,444.15,,,Arapahoe,On-Air,,Colorado Amateur Repeater Network (CARN),,CCARC,2012-11-12,,,,,,,,yes,WR0AEN (B),jfindu lookup / dstar-users lookup,,,,,,,,,,,,,,,,,,,,,,,,,,,,,,,,,,,,,,,,,,,,,,,,,,,
53.17,-0.5,107.2,N6LXX,"Morrison, Mt. Morrison",CO,OPEN,A,,63.41,S,,08,10514,39.67340088,-105.21800232,53.17,52.67,107.2,,Jefferson,On-Air,"I-70,I-76,I-25,I-225",N6LXX,,CCARC,2019-03-25,,,,,N6LXX,,,,,,,,,,,,,,,,,,,Full-time to the N6LXX System .,,,,,,,,,,,,,,,,,,,,,29883,,,,,,,,,,,,,,,,
447.875,-5,107.2,N6LXX,"Morrison, Mt. Morrison",CO,OPEN,A,,63.41,S,,08,10513,39.67340088,-105.21800232,447.875,442.875,107.2,107.2,Jefferson,On-Air,"I-70,I-76,I-25,I-225",N6LXX,,CCARC,2017-03-09,,,,,N6LXX,,,,,,,,,,,,,,,,,,,Full-time to the N6LXX System .,,,,,,,,,,,,,,,,,,,,,29913,,,,,,,,,,,,,,,,
446.9375,-5,CC,N0SZ,"Idaho Springs, Squaw Mountain",CO,OPEN,,D,66.19,SSW,,08,7190,39.67979813,-105.49299622,446.9375,441.9375,,,Clear Creek,On-Air,,Rocky Mountain Ham Radio,,CCARC,2019-11-27,yes,7,RMHR c Record retrieved from radioid.net,,,,Rocky Mountain Ham Radio,,,,,See the website for programming information.,,310801,"Open Talkgroup View Assignment TS TG Access Rocky Mountain Wide 1 700 Full-Time Southern Colorado 2 719 Full-Time Central Regional 2 720 Full-Time Northern Colorado Regional 2 721 Full-Time function myFunction(id) { var x = document.getElementById(id); if (x.className.indexOf(""w3-show"") == -1) { x.className += "" w3-show""; } else { x.className = x.className.replace("" w3-show"", """"); } }",,,,,,,1,2,Full-time to the Colorado TRBO System .,RMHAM,,,,,,,,,,,,,,,,,,,,,,,,,,2,2,,,,,,,,,
146.94,-0.6,103.5,W0WYX,"Idaho Springs, Squaw Mountain",CO,OPEN,,,66.19,SSW,,08,81,39.67979813,-105.49299622,146.94,146.34,103.5,103.5,Clear Creek,On-Air,"Wide area: west to the Continental Divide, south to Colorado Springs, east to Limon, and north to Cheyenne.",Rocky Mtn Radio League,11,CCARC,2017-03-11,,,,,,Colorado WX: Daily at 06:30. RMRL: Mod at 20:30. Astronomy: Tue at 19:00. Amateur Radio Events: Tue at 20:00.,Repeater,,,,DM79GQ,,,,,,,,,,,,,"Linkable to 449.82500 (W0WYX) at Broomfield, CO . Linkable to 449.45000 (K1DUN) at Idaho Springs, Squaw Mountain, CO .",,,,,Autopatch: 911* / Off 0*.,,,,,,,,,,,,,,,,,,,,Listen Live,,,,,,,,,,,,
146.67,-0.6,100,KB0UDD,"Idaho Springs, Squaw Mountain",CO,OPEN,,,66.2,SSW,,08,78,39.6794014,-105.49199677,146.67,146.07,100,100,Clear Creek,On-Air,"North to Cheyenne, Wy - East to Limon, Co - South to Colorado Springs, Co and West to the Continental Divide.",Castle Rock Repeater Group,11,CCARC,2019-11-11,,,,,,CRRG/QCWA: Sun at 0930. Southern Metro LDS Ham Group: Sun at 1900. ARES23: Thu at 1930. ARES13: Sun at 2000.,,,,,,,,,,,,,,,,,,,,,,,,,,,,,,,,,,,,,,,,,,,,,,,,,,,,,,,
147.3,0.6,103.5,N0PYY,"Evergreen, Squaw Mountain",CO,OPEN,,,66.2,SSW,,08,84,39.67810059,-105.48699951,147.3,147.9,103.5,103.5,Clear Creek,On-Air,Wide area.,Denver PD EEB,,CCARC,2017-03-11,,,,,,,,,,,DM79GQ,,,,,,,,,,,,,,,,,,,,,,,,,,,,,,,,,,,,,,,,,,,,,,,,,,
448.225,-5,141.3,N0SZ,"Idaho Springs, Squaw Mountain",CO,OPEN,,,66.2,SSW,,08,8197,39.67969894,-105.49299622,448.225,443.225,141.3,141.3,Clear Creek,On-Air,,Rocky Mountain Ham Radio,E-power(gen).,CCARC,2016-05-24,,,,,,,,,,,DM79GQ,,,,,,,,,,,,,,,,,,,,,,,,,,,,,,,,,,,,,,,,,,,,,,,,,,
145.145,-0.6,107.2,W0CRA,"Idaho Springs, Squaw Mountain",CO,OPEN,,,66.2,SSW,,08,107,39.6794014,-105.49199677,145.145,144.545,107.2,107.2,Clear Creek,On-Air,Wide area. Denver metro.,Colorado Repeater Assoc,E-power.,CCARC,2019-11-11,,,,,,,http://www.w0cra.org/info/squaw.html#145145,,,,,,,,,,,,,,,,,,,,,,,,,,,,,,,,,,,,,,,,,,,,,,,,,,,,,,
447.575,-5,107.2,W0CRA,"Idaho Springs, Squaw Mountain",CO,OPEN,EI,,66.2,SSW,ON - IDLE,08,264,39.6794014,-105.49199677,447.575,442.575,107.2,107.2,Clear Creek,On-Air,Wide area: Denver metro.,Colorado Repeater Association (CRA),,CCARC,2017-11-13,,,,,,,http://www.w0cra.org,,,,,,347088,,,,,,,,,,,,,,,,Member-only IRLP and Echolink node,,,,,,,,3291,,,,,,,,,,,,,,,,,,,,,,,,
145.49,-0.6,100,W0TX,"Idaho Springs, Centennial Cone",CO,OPEN,,,66.2,SSW,,08,76,39.6794014,-105.49199677,145.49,144.89,100,100,Jefferson,On-Air,,"KB0VIU, Denver Radio Club",E-power.,CCARC,2017-03-11,,,,,,DRC: Sun at 20:30.,DRC Repeaters,,,,,,,,,,,,,,,,,"Full-time to 448.62500 (W0TX) at Golden, Centennial Cone, CO .",,,,,,,,,,,,,,,,,,,,,,,,,,,,,,,,,,,,,
449.35,-5,100,W0TX,"Idaho Springs, Squaw Mountain",CO,OPEN,E,,66.2,SSW,Node Offline,08,98,39.6794014,-105.49199677,449.35,444.35,100,100,Clear Creek,On-Air,Wide area.,Denver Radio Club,11,CCARC,2017-03-11,,,,,,,DRC Repeaters,,,,,,4140,,,,,,,,,,,,,,,,,,,,,,,,,,,,,,,,,,,,,,,,,,,,,,,,
449.45,-5,103.5,K1DUN,"Idaho Springs, Squaw Mountain",CO,OPEN,,,66.22,SSW,,08,99,39.6794014,-105.49299622,449.45,444.45,103.5,127.3,Clear Creek,On-Air,"Wide area: West to the Continental Divide, south to Colorado Springs, east to Limon, and north to Cheyenne.",Rocky Mountain Radio League,11,CCARC,2016-12-23,,,,,,RMRL: Mon at 20:30.,Repeater,,,,DM79GQ,,,,,,,,,,,,,,,,,,,,,,,,,,,,,,,,,,,,,,,,,,,,,,,,,,
448.675,-5,100,W0CFI,"Idaho Springs, Squaw Mountain",CO,OPEN,,,66.26,SSW,,08,94,39.67739868,-105.48799896,448.675,443.675,100,100,Denver,On-Air,Wide area.,W0CFI,,CCARC,2020-02-06,,,,,,,,,,,,,,,,,,,,,,,,,,,,,,,,,,,,,,,,,,,,,,,,,,,,,,,,,,,,,
449,-5,136.5,WR0AEN,"Idaho Springs, Squaw Mountain",CO,OPEN,,,66.41,SSW,,08,8250,39.6731987,-105.48000336,449,444,136.5,136.5,Clear Creek,On-Air,,CARN,,CCARC,2017-03-11,,,,,,,,,,,,,,,,,,,,,,,,,,,,,,,,,,,,,,,,,,,,,,,,,,,,,,,,,,,,,
145.34,-0.6,103.5,KE4GUQ,Evergreen,CO,OPEN,I,,66.92,S,,08,73,39.63330078,-105.31700134,145.34,144.74,103.5,127.3,Jefferson,On-Air,Wide area.,Rocky Mtn Radio League,E-power.,CCARC,2019-08-15,,,,,,,Repeater,,,,,,,,,,,,,,,,,,,,,,,,,,,,,,3350,,,,,,,,,,,,,,,,,,,,,,,,
145.175,-0.6,CC,N0SZ,"Evergreen, Squaw Mountain",CO,OPEN,,D,66.92,S,,08,10932,39.63330078,-105.31700134,145.175,144.575,,,Clear Creek,On-Air,,Rocky Mountain Ham Radio,700,CCARC,2019-11-27,yes,7,RMHR c Record retrieved from radioid.net,,,,Rocky Mountain Ham Radio,,,,DM79IP,Voice ID is required for data/GPS/text on TG 705,,310810,,,,,,,,,,,,,,,,,,,,,,,,,,,,,,,,,,,,,,,,,,,,,,,
145.16,-0.6,88.5,KB0VJJ,"Walden, Peterson Ridge",CO,OPEN,,,68.22,W,,08,244,40.6493988,-106.38200378,145.16,144.56,88.5,123,Jackson,On-Air,"North Park, along with portions of I-80 from Laramie, Wyoming, to Rock Springs, Wyoming.",Colorado Connection,8,CCARC,2017-01-06,,,,,,Central Colorado Traffic Net: Daily at 19:30. Colorado Connection Net (all welcome): Thu at 20:00. Statewide ARES: Sun at 20:00.,,,,,,Part of the Colorado Connection system of repeaters.,,,,,,,,,,,,Full-time to the Colorado Connection System .,,,,,,,,,,,,,,,,,,,,,,,,,,,,,,,,,,,,,
145.19,-0.6,151.4,N0OBA,Aurora,CO,OPEN,E,,68.35,SSE,ON - IDLE,08,8741,39.62799835,-104.75800323,145.19,144.59,151.4,131.8,Arapahoe,On-Air,"Aurora, Littleton, Denver, Morrison, North Colorado Springs to as far as Ft. Collins.",N0OBA,Autopatch (please contact trustee).,,2018-02-01,,,,,,"""Tri Lakes Net"" This net is held every Monday at 7:30pm local (except on the third Monday of the month when we have our regular radio club meeting.)",,,,,DM79OP,"Please note the PL's! Do not TSQ unless your radio can do split PL's. Otherwise you will not here the system. Regards, Scott",10079,,,,,,,,,,,,,,,,,,,,,,,,,,,,,,,,,,,,,,,,,,,,,,,,
927.9375,-25.9,,KI0HC,"Indian Hills, Chief Mtn",CO,OPEN,,,68.41,S,,08,17457,39.59999847,-105.20999908,927.9375,902.025,,,Jefferson,On-Air,"Wide area coverage, I 25 from Cheyenne south to MM 20 just north of Trinidad. I 76 East to MM 100. I 70 from Idaho Springs to Genoa. Highway 24 from the Colorado Springs to Limon. Highway 24 west of Colorado Springs is spotty to Hartsel. US 50 from Canon City to Las Animas. Salida south to the San Luis Valley to Antonito. Salida North to just south of Leadville. Repeater Coverage Map",,,CCARC,2020-01-01,,,,,,,,,,,,,,,,,,,,,,,,Full-time to the The 900 P25 Network System .,,,,,,,,,,yes,293,yes,,,,,,,,,,,,,,,,,,,,,,,,,
145.4,-0.6,100,KB0UDD,"Aurora, Smoky Hill",CO,OPEN,,,69.97,SSE,,08,5,39.6072998,-104.74099731,145.4,144.8,100,,Arapahoe,On-Air,Greater Denver area.,Castle Rock Repeater Group,"Autopatch, e-power.",CCARC,2019-03-09,,,,,,,,,,,,,,,,,,,,,,,,"Full-time to 448.50000 (KB0UDD) at Aurora, Smokey Hill, CO .",,,,,,,,,,,,,,,,,,,,,,,,,,,,,,,,,,,,,
147.315,0.6,CC,N0KEG,Centennial,CO,OPEN,,DS,70.27,S,"Colorado Mega Reflector - XLX376 Transcoder - YSF 23160 - WiresX 40895 Welcome to the new and improved Colorado Mega Link! Brought to you by the Parker Radio Association, where we have fun, play radio and keep the squelch loose. Please join us Monday nights at 8pm mountain time our our digital net.",08,17676,39.58069992,-104.8769989,147.315,147.915,,,Arapahoe,,"Southeast metro Denver area. Parker, Centennial, SE Aurora, Elizabeth, Franktown, Castle Rock.",N0KEG,,,2019-11-27,yes,1,Brandmeister c Record retrieved from radioid.net,,Parker Radio Association,Monday 8pm. Colorado Link Digital Net. Repeater is used in DSTAR mode for this net.,https://www.parkerradio.org,yes,N0KEG (C) Repeater,jfindu lookup / dstar-users lookup,,,,310759,,,,,,,,,,,,,,,,,,,,,,,,,,,,,,,,,,Unknown,,,,,,,,,,,,,
448.2,-5,CC,W0FT,"Fort Morgan, Fort Morgan EOC",CO,OPEN,,D,71.4,SE,,08,10783,40.25030136,-103.80000305,448.2,443.2,,,Morgan,On-Air,,,Mixed Mode,CCARC,2019-11-27,yes,7,RMHR c Record retrieved from radioid.net,,NEAHR,,Rocky Mountain Ham Radio,,,,,"See the website for more info on Time Slot, Talk Group and Color Code Programming.",,310812,"Open Talkgroup View Assignment TS TG Access Rocky Mountain Wide 1 700 Northern Colorado Regional 2 721 function myFunction(id) { var x = document.getElementById(id); if (x.className.indexOf(""w3-show"") == -1) { x.className += "" w3-show""; } else { x.className = x.className.replace("" w3-show"", """"); } }",,,,,,,1,2,Full-time to the Colorado TRBO System .,,,,,,,,,,,,,,,,,,,,,,,,,,,,,,,,,,,,,
448.7,-5,146.2,WQ8M,Parker,CO,OPEN,,,72.62,SSE,,08,274,39.55799866,-104.79399872,448.7,443.7,146.2,,Douglas,On-Air,Local North Parker only,,,,2018-09-07,,,,,,,,,,,,,,,,,,,,,,,,,,,,,,,,,,,,,,,,,,,,,,,,,,,,,,,,,,,,,
1287.9,-20,CSQ,W0CRA,"Conifer, Conifer Mountain",CO,OPEN,,,74.46,S,,08,103,39.52109909,-105.30500031,1287.9,1267.9,CSQ,,Jefferson,Off-Air,Fort Collins to Colorado Springs.,Colorado Repeater Association (CRA),,CCARC,2017-10-07,,,,,,,,,,,,,,,,,,,,,,,,,,,,,,,,,,,,,,,,,,,,,,,,,,,,,,,,,,,,,
146.88,-0.6,100,N0PUF,"Centennial, Warren Mountain",CO,OPEN,,,74.74,S,,08,80,39.50419998,-105.12799835,146.88,146.28,100,,Jefferson,On-Air,Wide Area,Denver Radio League,E-power.,CCARC,2020-03-13,,,,,,,DRL Repeaters,,,,,6,,,,,,,,,,,,,,,,,,,,,,,,,,,,,,,,,,,,,,,,,,,,,,,,,
449.6,-5,100,N0PUF,"Centennial, Warren Mountain",CO,OPEN,EI,Y,74.74,S,Node Offline,08,273,39.50419998,-105.12799835,449.6,444.6,,,Jefferson,On-Air,,Denver Radio League,,CCARC,2020-03-13,,,,,,,DRL Repeaters,,,,,,690473,,,,,,,,,,,,,,,,,,yes,Open ↑ / Open ↓,,,,,3345,,,,,,,,,,,,,,,,,,,,,,,,
147.12,0.6,88.5,N0ARA,"Critchell, Critchell Mountain",CO,OPEN,,,75.32,S,,08,59,39.51480103,-105.35299683,147.12,147.72,88.5,88.5,Jefferson,On-Air,Denver metro and east.,Aurora Repeater Association,E-power.,CCARC,2016-01-17,,,,,,,http://www.n0ara.org,,,,DM79HM,,,,,,,,,,,,,,,,,,,,,,,,,,,,,,,,,,,,,,,,,,,,,,,,,,
446.9,-5,,K0PRA,Parker,CO,OPEN,W,Y,75.66,SSE,,08,18248,39.51860046,-104.76100159,446.9,441.9,,,Arapahoe,On-Air,Small coverage area in Parker,Parker Radio Association,Linked to the Colorado Mega digital system,,2019-11-03,,,,,,Monday nights 8pm mountain,https://www.parkerradio.org,,,,,,,,,,,,,,,,,,,,,,,,yes,Open ↑ / Open ↓,,,,,,,,,,,,,,,,,,40895,,,,,,,,,,,
448.05,-5,CC,N0KEG,Parker,CO,OPEN,,D,75.66,SSE,,08,17696,39.51860046,-104.76100159,448.05,443.05,,,Douglas,,,,,,2019-11-27,yes,1,Brandmeister c Record retrieved from radioid.net,BrandMeister,,,,,,,,,,310374,,,,,,,,,,,,,,,,,,,,,,,,,Brandmeister,,,,,,,,,Unknown,,,,,,,,,,,,,
447.525,-5,203.5,N0ESQ,"Parker, Hess Reservoir",CO,OPEN,,,76.53,S,,08,8189,39.49420166,-104.83599854,447.525,442.525,203.5,146.2,Douglas,On-Air,"Denver metropolitan area, front range foothills",EmComm Colorado,,CCARC,2017-03-11,,,,,Colorado ARES,,,,,,DM79NL,"Not a ragchew machine. Traffic related to ARES, RACES and administrative and exercise traffic related thereto.",,,,,,,,,,,,,,,,,,,,,,,,,,,,,,,,,,,,,,,,,,,,,,,,,
147.165,0.6,114.8,KC7SNO,Albin,WY,OPEN,,,77.15,NE,,56,28,41.4178009,-104.09799957,147.165,147.765,114.8,,Laramie,On-Air,,Shy-Wy Amateur Radio Club,E-power.,WRCG,2017-01-04,,,,,,,,,,,,,,,,,,,,,,,,"Full-time to 147.10500 (KC7SNO) at Cheyenne, North Park, WY . Full-time to 146.77500 (KC7SNO) at Cheyenne, Denver Hill, WY .",,,,,,,,,,,,,,,,,,,,,,,,,,,,,,,,,,,,,
927.7375,-25.7,100,KI0HC,Parker,CO,OPEN,,,77.25,SSE,,08,14732,39.53910065,-104.56900024,927.7375,902.025,100,100,Douglas,On-Air,"Wide area coverage, I 25 from Cheyenne south to MM 20 just north of Trinidad. I 76 East to MM 100. I 70 from Idaho Springs to Genoa. Highway 24 from the Colorado Springs to Limon. Highway 24 west of Colorado Springs is spotty to Hartsel. US 50 from Canon City to Las Animas. Salida south to the San Luis Valley to Antonito. Salida North to just south of Leadville. Repeater Coverage Map",,,CCARC,2020-01-01,,,,,,,,,,,DM79RM,,,,,,,,,,,,,Full-time to the The 900 P25 Network System .,,,,,,,,,Yes; analog capable.,yes,293,yes,,,,,,,,,,,,,,,,,,,,,,,,,
447.5,-5,88.5,N0OWY,"Conifer, Critchell Mountain",CO,OPEN,,,77.28,S,,08,60,39.47029877,-105.19799805,447.5,442.5,88.5,88.5,Jefferson,On-Air,Wide area.,Aurora Repeater Association,E-power.,CCARC,2014-04-28,,,,,,,,,,,DM79JL,,,,,,,,,,,,,,,,,,,,,,,,,,,,,,,,,,,,,,,,,,,,,,,,,,
147.075,0.6,88.5,KB0VJJ,"Kremmling, Santoy Peak",CO,OPEN,,,77.73,WSW,,08,166,40.05889893,-106.38800049,147.075,147.675,88.5,123,Grand,On-Air,Flattops Wilderness Area well and can even be worked from the Front Range in some locations. Coverage at the east end of Glenwood Canyon to Eagle is available in some spots along I-70. Map,Colorado Connection,,CCARC,2016-05-23,,,,,,Colorado Traffic Net: Daily at 19:30. Colorado Connection Net (all welcome): Thu at 20:00. Statewide ARES: Sun at 20:00.,,,,,,Part of the Colorado Connection system of Repeaters,,,,,,,,,,,,Full-time to the Colorado Connection System .,,,,,,,,,,,,,,,,,,,,,,,,,,,,,,,,,,,,,
445.075,-5,CC,K0PRA,Parker,CO,OPEN,,D,81.06,SSE,"Colorado Mega Reflector - XLX376 Transcoder - YSF 23160 - WiresX 40895 Welcome to the new and improved Colorado Mega Link! Brought to you by the Parker Radio Association, where we have fun, play radio and keep the squelch loose. Please join us Monday nights at 8pm mountain time our our digital net.",08,17292,39.44910049,-104.70300293,445.075,440.075,,,Douglas,On-Air,,Parker Radio Association,Brandmeister Network https://brandmeister.network/?page=repeater&amp;id=310844,CCARC,2019-11-27,yes,1,None c Record retrieved from radioid.net,,,Mondays 20:30 MST,http://www.parkerradio.org,,,,,Mixed Mode,,310844,,,,,,,,,,,,,,,,,,,,,,,,,,,,,,,,,,,,,,,,,,,,,,,
146.895,-0.6,100,AB0PC,"Bailey, Dick Mountain",CO,OPEN,A,,84.07,SSW,,08,7,39.4056015,-105.47299957,146.895,146.295,100,100,Park,On-Air,285,AB0RR,25,CCARC,2017-07-05,,,,,,Wed at 19:30.,Park County Radio Club (PCRC),,,,,,,,,,,,,,,,,"Full-time internet linked to 448.57500 (WZ0N) at Hartsel, CO .",,,,,,,,,,,,,,,,,,,,,45835,,,,,,,,,,,,,,,,
446.85,-5,,K0PRA,Franktown,CO,OPEN,,S,85.15,SSE,,08,11473,39.39350128,-104.67500305,446.85,441.85,,,Douglas,On-Air,,Parker Radio Association,D-Star B module,CCARC,2018-03-18,,,,,,,http://parkerradio.org,yes,K0PRA (B) Repeater,jfindu lookup / dstar-users lookup,DM79PJ,,,,,,,,,,,,,,,,,,,,,,,,,,,,,,,,,,,,,,,,,,,,,,,,,,
445.0875,-5,CC,N0SZ,"Breckenridge, Baldy",CO,OPEN,,D,91.1,SSW,,08,16780,39.45899963,-105.97899628,445.0875,440.0875,,,Fremont,On-Air,,K2AD,,,2019-11-27,yes,7,RMHAM c Record retrieved from radioid.net,,Rocky Mountain Ham Radio,,http://www.rmham.org/,,,,DM79AL,,,310830,,,,,,,,,,,,,,,,,,,,,,,,,,,,,,,,,,,,,,,,,,,,,,,
446.925,-5,CC,N0ESQ,"Castle Rock, Devils Head",CO,OPEN,,D,91.26,S,,08,7193,39.26480103,-105.11399841,446.925,441.925,,,Douglas,On-Air,,,,CCARC,2019-11-27,yes,8,RMHR c Record retrieved from radioid.net,,,,Rocky Mountain Ham Radio,,,,DM79KG,See the website for programming info.,,310817,"Open Talkgroup View Assignment TS TG Access Southern Colorado 1 719 Devilshead Local 2 711 function myFunction(id) { var x = document.getElementById(id); if (x.className.indexOf(""w3-show"") == -1) { x.className += "" w3-show""; } else { x.className = x.className.replace("" w3-show"", """"); } }",,,,,,,,,Full-time to the Colorado TRBO System .,,,,,,,,,,,,,,,,,,,,,,,,,,,1,,2,,,,,,,,
447.525,-5,146.2,N0ESQ,"Castle Rock, Devils Head (Pike National Forest)",CO,OPEN,,,91.26,S,,08,8190,39.26480103,-105.11399841,447.525,442.525,146.2,146.2,Douglas,On-Air,"Denver metro north to the Wyoming border. Back country including Bailey, Deckers, Woodland Park. Severe null due east due to Devils Head Peak.",EmComm Colorado,,CCARC,2015-06-17,,,,,Colorado ARES,,,,,,DM79KG,"This is not a ragchew machine. Traffic is limited to ARES, RACES and EmComm administrative, exercise, public service and disaster response.",,,,,,,,,,,,,,,,,,,,,,,,,,,,,,,,,,,,,,,,,,,,,,,,,
146.7,-0.6,107.2,WB0QMR,Breckenridge,CO,OPEN,I,,91.44,SW,,08,23,39.4817009,-106.03800201,146.7,146.1,107.2,,Summit,On-Air,,GRARC,E-power.,CCARC,2013-01-07,,,,,,,,,,,,,,,,,,,,,,,,,,,,,,,,,,,,,3972,,,,,,,,,,,,,,,,,,,,,,,,
147.39,0.6,88.5,KB0VJJ,"Breckenridge, Bald Mountain",CO,OPEN,,,91.72,SSW,,08,24,39.44390106,-105.96900177,147.39,147.99,88.5,123,Summit,On-Air,Wide area.,Colorado Connection,12,CCARC,2019-11-08,,,,,,Central Colorado Traffic Net: Daily at 19:30. Colorado Connection Net (all welcome): Thu at 20:00. Statewide ARES: Sun at 20:00.,Breckenridge Repeater,,,,DM79AK,"Please Note that 146.790 is the old Breckenridge frequency and this repeater may return to that frequency eventually but is now working on 147.390-. This machine has a split tone, 88.5 rx and 123.0 tx",,,,,,,,,,,,Full-time to the Colorado Connection System .,,,,,,,,,,,,,,,,,,,,,,,,,,,,,,,,,,,,,
147.21,0.6,107.2,KD0H,Steamboat Springs,CO,OPEN,,,92,W,,08,237,40.48500061,-106.83100128,147.21,147.81,107.2,107.2,Routt,On-Air,,SSARC,"Linked, WX.",CCARC,2014-09-27,,,,,,,,,,,,,,,,,,,,,,,,,,,,,,,,,,,,,,,,,,,,,,,,,,,,,,,,,,,,,
147.165,0.6,88.5,KB0VJJ,Steamboat Springs,CO,OPEN,,,92.06,W,,08,15579,40.48500061,-106.83200073,147.165,147.765,88.5,123,Routt,On-Air,,Colorado Connection,,,2017-01-06,,,,,,,,,,,,,,,,,,,,,,,,Full-time to the Colorado Connection System .,,,,,,,,,,,,,,,,,,,,,,,,,,,,,,,,,,,,,
449.625,-5,123,KB0VJJ,Steamboat Springs,CO,OPEN,,,92.06,W,,08,9770,40.48500061,-106.83200073,449.625,444.625,123,123,Routt,On-Air,Local Steamboat Area,"Colorado Connection Repeaters, Inc.",Statewide Linked System,,2019-05-11,,,,,,Central Colorado Traffic Net: Daily at 19:30. Colorado Connection Net: Thu at 20:00 (All welcome). Statewide ARES Net: Sundays at 20:00.,http://colcon.org,,,,,,,,,,,,,,,,,,,,,,,,,,,,,,,,,,,,,,,,,,,,,,,,,,,,,,
147,-0.6,103.5,N0NEB,Harrisburg,NE,OPEN,,,93.3,NE,,31,58,41.49000168,-103.75499725,147,146.4,103.5,,Banner,On-Air,,Tri-City Radio Amateur Club,,,2017-09-07,,,,,,,,,,,DN81CL,,,,,,,,,,,,,,,,,,,,,,,,,,,,,,,,,,,,,,,,,,,,,,,,,,
224.8,-1.6,,N0AFO,Vail,CO,OPEN,,,94.39,SW,,08,242,39.64030075,-106.37400055,224.8,223.2,,,Eagle,Off-Air,,ECHO,,CCARC,2018-06-02,,,,,,,,,,,,,,,,,,,,,,,,,,,,,,,,,,,,,,,,,,,,,,,,,,,,,,,,,,,,,
449.9,-5,107.2,N0AFO,Vail,CO,OPEN,,,94.39,SW,,08,243,39.64030075,-106.37400055,449.9,444.9,107.2,107.2,Eagle,Off-Air,,ECHO,,CCARC,,,,,,,,,,,,,,,,,,,,,,,,,,,,,,,,,,,,,,,,,,,,,,,,,,,,,,,,,,,,,,
146.61,-0.6,107.2,K0RV,"Vail, Bald Mountain",CO,OPEN,,,95.38,SW,,08,256,39.60609818,-106.35600281,146.61,146.01,107.2,,Eagle,On-Air,,ECHO,11,CCARC,2012-11-10,,,,,,,,,,,,,,,,,,,,,,,,,,,,,,,,,,,,,,,,,,,,,,,,,,,,,,,,,,,,,
147.345,0.6,88.5,KB0VJJ,Vail,CO,OPEN,,,96.91,SW,,08,241,39.65539932,-106.45700073,147.345,147.945,88.5,123,Eagle,On-Air,Wide area: Vail Pass to Glenwood Canyon and the Flattops Wilderness to Tennessee Pass. Map,Colorado Connection,9,CCARC,2017-01-06,,,,,,Central Colorado Traffic Net: Daily at 19:3030 Colorado Connection Net (All Welcome): Thu at 20:00. Statewide ARES net: Sun at 20:00.,,,,,,,,,,,,,,,,,,Full-time to the Colorado Connection System .,,,,,,,,,,,,,,,,,,,,,,,,,,,,,,,,,,,,,
147.225,0.6,107.2,W0CRA,"Larkspur, Westcreek",CO,OPEN,EI,,97.45,S,ON - IDLE,08,83,39.17549896,-105.03399658,147.225,147.825,107.2,107.2,Douglas,On-Air,Wide area,Colorado Repeater Association (CRA),Closed autopatch,CCARC,2017-11-13,,,,,CRA VHF Link System,"CRA Net, Sunday 9AM",Colorado Repeater Association,,,,DM79LE,,347086,,,,,,,,,,,"Full-time to 145.16000 (W0CRA) at Colorado Springs, Cheyenne Mountain, CO . Full-time to 145.46000 (W0CRA) at Boulder, Eldorado Mountain, CO .",,,,,,,,,,,,,3990,,,,,,,,,,,,,,,,,,,,,,,,
448.425,-5,107.2,W0CRA,"Larkspur, Westcreek",CO,OPEN,,,97.45,S,,08,16547,39.17549896,-105.03399658,448.425,443.425,107.2,107.2,Douglas,On-Air,Wide area 55 mi radius.,Colorado Repeater Association (CRA),E-Power,CCARC,2020-02-11,,,,,ARESDEC,,http://www.w0cra.org,,,,,,,,,,,,,,,,,"Full-time to 147.10500 (WA0DE) at Simla, CO .",,,,,,,,,,,,,,,,,,,,,,,,,,,,,,,,,,,,,
445.075,-5,CC,N0SZ,Vail,CO,OPEN,,D,97.47,SW,,08,16781,39.63479996,-106.4469986,445.075,440.075,,,Eagle,On-Air,,K2AD,,CCARC,2019-11-27,yes,7,RMHR c Record retrieved from radioid.net,,Rocky Mountain Ham Radio,,http://www.rmham.org/,,,,DM69SP,,,310851,,,,,,,,,,,,,,,,,,,,,,,,,,,,,,,,,,,,,,,,,,,,,,,
449.975,-5,100,K0JSC,"Larkspur, Westcreek",CO,OPEN,,,97.49,S,,08,15903,39.17490005,-105.03399658,449.975,444.975,100,100,Douglas,On-Air,,K0JSC,Simulcast and Voted with Cedarwood and Methodist.,CCARC,2017-04-21,,,,,The Fun Machine,,The Fun Machine,,,,,"Can be linked to Allstar, Echolink and others by a Sysop",,,,,,,,,,,,Full-time to the The Fun Machine System .,,,,,,,,,,,,,,,,,,,,,,,,,,,,,,,,,,,,,
145.295,-0.6,100,WA0JTB,"Sterling, CO",CO,OPEN,,,98.5,ESE,,08,238,40.62559891,-103.20700073,145.295,144.695,100,,Logan,On-Air,Wide area,NECARA,"Autopatch, e-power.",CCARC,2020-01-17,,,,,,,,,,,,,,,,,,,,,,,,,,,,,,,,,,,,,,,,,,,,,,,,,,,,,,,,,,,,,
446.875,-5,CC,N0SZ,Westcreek,CO,OPEN,,D,99.09,S,,08,15900,39.15250015,-105.16400146,446.875,441.875,,,Douglas,On-Air,,W0VG,,CCARC,2019-11-27,yes,6,RMHAM c Record retrieved from radioid.net,,RMHAM,,http://www.rmham.org,,,,,,,310846,"Open Talkgroup View Assignment TS TG Access Rocky Mountain Wide 1 700 Full-Time Central Regional 2 720 Full-Time function myFunction(id) { var x = document.getElementById(id); if (x.className.indexOf(""w3-show"") == -1) { x.className += "" w3-show""; } else { x.className = x.className.replace("" w3-show"", """"); } }",,,,,,,1,,Full-time to the Colorado TRBO System .,,,,,,,,,,,,,,,,,,,,,,,,,,,,2,,,,,,,,,
145.19,-0.6,131.8,N0XLF,"Palmer Lake, Monument Hill",CO,OPEN,E,,100.49,S,ON - IDLE,08,8740,39.13600159,-104.92700195,145.19,144.59,131.8,131.8,Douglas,On-Air,Wide area coverage at 8300,N0OBA Owner,,,2018-10-25,,,,,,Tri Lakes Net: Mon at 19:30 (except third Monday of the month which is the regular radio club meeting).,,,,,DM79MD,,10079,,,,,,,,,,,,,,,,,,,,,,,,,,,,,,,,,,,,,,,,,,,,,,,,
224.68,-1.6,,AE7AF,Wheatland,WY,OPEN,,,101.74,N,,56,15538,42.0544014,-104.95300293,224.68,223.08,,,Platte,On-Air,,,,,2017-10-12,,,,,,,,,,,,,,,,,,,,,,,,,,,,,,,,,,,,,,,,,,,,,,,,,,,,,,,,,,,,,
146.88,-0.6,,WA7SNU,Wheatland,WY,OPEN,,,101.74,N,,56,47,42.0544014,-104.95200348,146.88,146.28,,,Platte,On-Air,,GPARA,,,2019-02-21,,,,,,,,,,,,,,,,,,,,,,,,,,,,,,,,,,,,,,,,,,,,,,,,,,,,,,,,,,,,,
449.625,-5,151.4,WA7SNU,Wheatland,WY,OPEN,,,101.74,N,,56,16476,42.0544014,-104.95300293,449.625,444.625,151.4,,Platte,On-Air,,,,,2017-10-12,,,,,,,,,,,,,,,,,,,,,,,,,,,,,,,,,,,,,,,,,,,,,,,,,,,,,,,,,,,,,
