Frequency,Offset,Tone,Call,Location,ST/PR,Use,VOIP,DGTL,Mi,Dir,,state_id,ID,Latitude,Longitude,Downlink,Uplink,Uplink Tone,Downlink Tone,County,Op Status,Coverage,Sponsor,Features,Coordination,Last update,DMR Enabled,Color Code,IPSC Network,Wide Network,Affiliate,Nets,Web links,D-STAR Enabled,Node,Sources,Grid,Notes,EchoLink,DMR ID,Talkgroups,Worldwide,North America,English,TAC 310,Local/Cluster,N. Colorado,Rocky Mountain Wide,Northern Colorado Regional,Links,Talkgroup Network,Worldwide English,DCI Bridge,Colorado,Commands,Mountain Reg USA,YSF Digital Enabled,DG-ID,Mixed-Mode,P-25 Digital Enabled,NAC,Default Reflector,IRLP,Bandwidth,Local Network,RX Location,Gunbarrel,Lousville,Lyons,Louisville #2,AllStar,Wyoming,WyLOCAL,On-air,Feed,WIRES-X,Southern Colorado,Central Regional,Devilshead Local,NXDN Enabled,RAN,NXDN Bandwidth,NXDN Network,Eastern Colorado,TAC 311,Colorado Chat,Location Photo
449.85,-5,100,W0QEY,"Fort Collins, CSU Durward Hall",CO,OPEN,,,0,NNE,,08,124,40.58530045,-105.08399963,449.85,444.85,100,100,Larimer,On-Air,Map,CO State Univ ARC,Closed autopatch.,CCARC,2012-11-16,,,,,,,,,,,,,,,,,,,,,,,,,,,,,,,,,,,,,,,,,,,,,,,,,,,,,,,,,,,,,
927.95,-25,100,W0QEY,"Fort Collins, CSU Durward Hall",CO,OPEN,,,0,NNE,,08,3592,40.58530045,-105.08399963,927.95,902.95,100,100,Larimer,On-Air,Northern Front Range,,,CCARC,2019-09-01,,,,,,,,,,,,,,,,,,,,,,,,,,,,,,,,,,,,,,,,,,,,,,,,,,,,,,,,,,,,,
446.7625,-5,CC,W0QEY,"Fort Collins, CSU Durward Hall",CO,OPEN,,D,0.71,SW,,08,18416,40.57759857,-105.09300232,446.7625,441.7625,,,Larimer,On-Air,,RMHAM,,,2020-02-10,yes,8,c Record retrieved from radioid.net,,CSUARC,Red Cross Net on Wide - Third Thursday of the month at 1900 Tech Net on Wide - First Saturday of the month at 1900,https://www.rmham.org/wordpress/dmr-radio-site-information/,,,,,,,,,,,,,,,,,,,,,,,,,,,,,,,,,,,,,,,,,,,,,,,,,,,,,,
446.7625,-5,CC,W0QEY,"Fort Collins, CSU Durward Hall",CO,OPEN,,D,0.71,SW,,08,18417,40.57759857,-105.09300232,446.7625,441.7625,,,Larimer,On-Air,,RMHAM,,,2020-02-10,yes,8,c Record retrieved from radioid.net,,CSUARC,Red Cross Net on Wide - Third Thursday of the month at 1900 Tech Net on Wide - First Saturday of the month at 1900,https://www.rmham.org/wordpress/dmr-radio-site-information/,,,,,,,,,,,,,,,,,,,,,,,,,,,,,,,,,,,,,,,,,,,,,,,,,,,,,,
446.8125,-5,,W0QEY,"Fort Collins, CSU Durward Hall",CO,OPEN,,S,0.71,SW,,08,8901,40.57770157,-105.09300232,446.8125,441.8125,,,Larimer,On-Air,Fort Collins Local Area,W0QEY CSU,D-Star Gateway,CCARC,2017-05-31,,,,,,,,yes,W0QEY (B) Repeater,jfindu lookup / dstar-users lookup,DN70KN,Free Star,,,,,,,,,,,,,,,,,,,,,,,,,,,,,,,,,,,,,,,,,,,,,,,,,
147.36,0.6,100,W0QEY,"Fort Collins, CSU Durward Hall",CO,OPEN,,,1.07,SSE,,08,125,40.57080078,-105.07700348,147.36,147.96,100,100,Larimer,On-Air,Map,CO State Univ ARC,Closed autopatch.,CCARC,2017-03-11,,,,,,,,,,,,,,,,,,,,,,,,,,,,,,,,,,,,,,,,,,,,,,,,,,,,,,,,,,,,,
1283.55,-20,100,K1TJ,Fort Collins,CO,OPEN,,,5.86,SW,,08,3620,40.51530075,-105.14700317,1283.55,1263.55,100,,Larimer,On-Air,Northern Colorado Front Range,K1TJ Repeater System,,CCARC,2013-01-01,,,,,,,http://www.k1tj.com/,,,,DN70KM,,,,,,,,,,,,,,,,,,,,,,,,,,,,,,,,,,,,,,,,,,,,,,,,,,
447.45,-5,123,KC0RBT,Fort Collins,CO,OPEN,E,,5.86,SW,ON - IDLE,08,276,40.51530075,-105.14700317,447.45,442.45,123,,Larimer,On-Air,,,,CCARC,2016-02-01,,,,,,,,,,,,,447450,,,,,,,,,,,,,,,,,,,,,,,,,,,,,,,,,,,,,,,,,,,,,,,,
446.7375,-5,CC,N0AOL,Fort Collins,CO,OPEN,,D,5.86,SW,,08,8505,40.51530075,-105.14700317,446.7375,441.7375,,,Larimer,On-Air,Wide area: North Front Range.,N0AOL - NoCo C-Bridge Network,DMR-MARC World Wide Network,CCARC,2019-11-27,yes,2,NoCo c Record retrieved from radioid.net,,,"DMR World Wide Net: Sat at 10:00. TS 1 Group Call 1 http://www.dmr-marc.net/ Tac 310 Net: Sun at 18:00, TS 1 Group Call 310 .",http://nocodmr.kt0l.net:8080/nocodmr/documentation.htm,,,,DN70KM,Repeater ID: 310803,,310803,"Open Talkgroup View Assignment TS TG Access Worldwide 1 1 North America 1 3 English 1 13 TAC 310 1 310 Local/Cluster 2 2 N. Colorado 2 3171 function myFunction(id) { var x = document.getElementById(id); if (x.className.indexOf(""w3-show"") == -1) { x.className += "" w3-show""; } else { x.className = x.className.replace("" w3-show"", """"); } }",1,1,1,1,2,2,,,,,,,,,,,,,,,,,,,,,,,,,,,,,,,,,,,,,,,,
446.75,-5,CC,K7PFJ,"Fort Collins, Horsetooth Mountain",CO,OPEN,,D,5.93,WSW,,08,8715,40.53879929,-105.17900085,446.75,441.75,,,Larimer,Off-Air,,Rocky Mountain Ham Radio,,CCARC,2019-12-09,yes,7,RMHR c Record retrieved from radioid.net,,,,http://www.rmham.org,,,,,See website for complete info on color codes/time slot assignment.,,310814,"Open Talkgroup View Assignment TS TG Access Rocky Mountain Wide 1 700 Northern Colorado Regional 2 721 function myFunction(id) { var x = document.getElementById(id); if (x.className.indexOf(""w3-show"") == -1) { x.className += "" w3-show""; } else { x.className = x.className.replace("" w3-show"", """"); } }",,,,,,,1,2,Full-time to the Colorado TRBO System .,,,,,,,,,,,,,,,,,,,,,,,,,,,,,,,,,,,,,
145.265,-0.6,CC,KB0VGD,"Fort Collins, Horsetooth Mountain",CO,OPEN,,D,5.93,WSW,"KB0VGD Marcos 2M Horsetooth Horsetooth Mtn VHF, Wide area coverage. Please use ONLY TG 310831, TG 3171, TG 3108, and TG 2 (Local 2) on Time Slot 2 (TS2). ALL OTHER TG connections will be directed to Time Slot 1 (TS1).",08,14274,40.53879929,-105.17900085,145.265,144.665,,,Larimer,On-Air,Northern Colorado Front Range Wide Area coverage.,W0DMR - NoCo C-bridge Network,,CCARC,2019-11-27,yes,2,DMR-Plus c Record retrieved from radioid.net,,Brandmeister Network,,http://www.w0dmr.org/,,,,,"Any additional Brandmeister talk group is available on time slot 1, too many to list here, see website. https://dmrx.net/files/US_BM_User_Guide.pdf",,310831,"Open Talkgroup View Assignment TS TG Access Worldwide English 1 91 Full-Time North America 1 93 Full-Time DCI Bridge 1 3100 Full-Time Local/Cluster 2 2 Colorado 2 3108 Full-Time N. Colorado 2 3171 Full-Time function myFunction(id) { var x = document.getElementById(id); if (x.className.indexOf(""w3-show"") == -1) { x.className += "" w3-show""; } else { x.className = x.className.replace("" w3-show"", """"); } }",,1,,,2,2,,,,BrandMeister US,1,1,2,"Repeater ID: 310831, TS 1: TG 91 - World Wide, TG 93 - North America, TG 3100 USA. TS 2: TG 2 - Local, TG 3171 - No. Colorado, TG 3108 Colorado Statewide.",,,,,,,,,,,,,,,,,,,,,,,,,,,,,,,,
447.725,-5,131.8,W7RF,Fort Collins,CO,OPEN,,,6.18,S,,08,8194,40.49599838,-105.07900238,447.725,442.725,131.8,,Larimer,On-Air,,W7RF,,CCARC,2018-05-13,,,,,,,,,,,DN70LL,,,,,,,,,,,,,,,,,,,,,,,,,,,,,,,,,,,,,,,,,,,,,,,,,,
145.115,-0.6,100,W0UPS,"Fort Collins, Horsetooth Mountain",CO,OPEN,E,,6.67,WSW,ON - IDLE,08,123,40.53969955,-105.19599915,145.115,144.515,100,100,Larimer,On-Air,Wide area.,Northern Colorado ARC,7,CCARC,2016-10-25,,,,,,,,,,,DN70JM,,4236,,,,,,,,,,,,,,,,,,,,,,,,,,,,,,,,,,,,,,,,,,,,,,,,
224.52,-1.6,100,W0UPS,"Fort Collins, Horsetooth Mountain",CO,OPEN,,,6.67,WSW,,08,275,40.53969955,-105.19599915,224.52,222.92,100,100,Larimer,Off-Air,,Northern Colorado ARC,E-power.,CCARC,2018-03-21,,,,,,,,,,,,,,,,,,,,,,,,,,,,,,,,,,,,,,,,,,,,,,,,,,,,,,,,,,,,,
447.275,-5,100,W0UPS,"Fort Collins, Horsetooth Mountain",CO,OPEN,,,6.67,WSW,,08,126,40.53969955,-105.19599915,447.275,442.275,100,100,Larimer,On-Air,Wide area.,Northern Colorado ARC,"Closed autopatch, e-power.",CCARC,2020-01-23,,,,,,,,,,,,,,,,,,,,,,,,,,,,,,,,,,,,,,,,,,,,,,,,,,,,,,,,,,,,,
147.39,0.6,CC,W0DMR,"Fort Collins, Timnath",CO,OPEN,,D,7.87,SE,,08,12562,40.54460144,-104.94400024,147.39,147.99,,,Larimer,On-Air,"Fort Collins east side, into Red Feather Lakes area.",KT0L - NoCo C-Bridge Network,,CCARC,2019-11-27,yes,2,NoCO c Record retrieved from radioid.net,,,Tac 310 Net: Sun at 18:00.,Documentation,,,,,,,310822,"Open Talkgroup View Assignment TS TG Access TAC 310 1 310 DCI Bridge 1 3100 N. Colorado 1 3171 Mountain Reg USA 1 3177 Local/Cluster 2 2 function myFunction(id) { var x = document.getElementById(id); if (x.className.indexOf(""w3-show"") == -1) { x.className += "" w3-show""; } else { x.className = x.className.replace("" w3-show"", """"); } }",,,,1,2,1,,,,,,1,,,1,,,,,,,,,,,,,,,,,,,,,,,,,,,,,,,
446.775,-5,CC,W0DMR,"Fort Collins, Timnath",CO,OPEN,,D,8.31,ESE,"Rick KT0L Repeater Ft Collins, CO (Limited coverage)",08,10995,40.59379959,-104.9260025,446.775,441.775,,,Larimer,On-Air,"Fort Collins east side, into Red Feather Lakes area.",W0DMR - NoCo C-bridge Network,,CCARC,2019-11-27,yes,2,NoCO c Record retrieved from radioid.net,,Brandmeister Network,,W0DMR,,,,DN70MO,"Any additional Brandmeister talk group is available on time slot 1, too many to list here, see website. https://dmrx.net/files/US_BM_User_Guide.pdf",,310806,"Open Talkgroup View Assignment TS TG Access Worldwide English 1 91 Full-Time North America 1 93 Full-Time DCI Bridge 1 3100 Full-Time Local/Cluster 2 2 Colorado 2 3108 Full-Time N. Colorado 2 3171 Full-Time function myFunction(id) { var x = document.getElementById(id); if (x.className.indexOf(""w3-show"") == -1) { x.className += "" w3-show""; } else { x.className = x.className.replace("" w3-show"", """"); } }",,1,,,2,2,,,,BrandMeister US,1,1,2,"Repeater ID: 310806, TS 1: TG 91 - World Wide, TG 93 - North America, TG 3100 USA. TS 2: TG 2 - Local, TG 3171 - No. Colorado, TG 3108 Colorado Statewide.",,,,,,,,,,,,,,,,,,,,,,,,,,,,,,,,
448.325,-5,110.9,WB7UPS,Wellington,CO,OPEN,,,9.09,NNE,,08,8251,40.70389938,-105.00900269,448.325,443.325,110.9,,Larimer,On-Air,,,,CCARC,2012-11-16,,,,,,,,,,,,,,,,,,,,,,,,,,,,,,,,,,,,,,,,,,,,,,,,,,,,,,,,,,,,,
447.2,-5,82.5,N6RFI,"Severance, Cactus Hill",CO,OPEN,,,9.35,ESE,,08,8188,40.58100128,-104.90599823,447.2,442.2,82.5,,Weld,On-Air,,N6RFI,,CCARC,2017-03-11,,,,,,,,,,,DN70NN,,,,,,,,,,,,,,,,,,,,,,,,,,,,,,,,,,,,,,,,,,,,,,,,,,
448.025,-5,100,W0UPS,"Loveland, Budweiser Event Center",CO,OPEN,,Y,10.96,SSE,,08,3621,40.44400024,-104.98899841,448.025,443.025,100,100,Larimer,On-Air,,Northern Colorado ARC,,CCARC,2016-03-21,,,,,,,,,,,DN70MK,,,,,,,,,,,,,,,,,,,,yes,Open ↑ / Open ↓,Yes; analog capable.,,,,,,,,,,,,,,,,,,,,,,,,,,,,
447.7,-5,100,W0UPS,"Fort Collins, Buckhorn Mountain",CO,OPEN,,,12.72,W,,08,5853,40.61109924,-105.3239975,447.7,442.7,100,100,Larimer,On-Air,Wide Area Coverage,Northern Colorado Amateur Radio Club,,,2014-09-02,,,,,,,http://ncarc.net/,,,,,,,,,,,,,,,,,"Linkable to 146.85000 (W0UPS) at Greeley, UNC, CO . Linkable to 146.62500 (W0UPS) at Fort Collins, Buckhorn Mountain, CO . Full-time to 224.84000 (W0UPS) at Fort Collins, Buckhorn Mountain, CO .",,,,,,,,,,,,,,,,,,,,,,,,,,,,,,,,,,,,,
445.2,-5,CC,N0SZ,"Fort Collins, Buckhorn Mountain",CO,OPEN,,D,12.94,W,,08,18418,40.61700058,-105.32700348,445.2,440.2,,,Larimer,On-Air,,RMHAM,,,2019-12-28,yes,7,c Record retrieved from radioid.net,,,Red Cross Net on Wide - Third Thursday of the month at 1900 Tech Net on Wide - First Saturday of the month at 1900,https://www.rmham.org/wordpress/dmr-radio-site-information/,,,,,,,,,,,,,,,,,,,,,,,,,,,,,,,,,,,,,,,,,,,,,,,,,,,,,,
146.625,-0.6,100,W0UPS,"Fort Collins, Buckhorn Mountain",CO,OPEN,,,12.94,W,,08,246,40.61700058,-105.32700348,146.625,146.025,100,100,Larimer,On-Air,Wide area: Northern front range.,Northern Colorado ARC,E-power.,CCARC,2017-03-11,,,,,,,,,,,DN70IO,,,,,,,,,,,,,"Linkable to 146.85000 (W0UPS) at Greeley, UNC, CO . Linkable to 224.84000 (W0UPS) at Fort Collins, Buckhorn Mountain, CO .",,,,,,,,,,,,,,,,,,,,,,,,,,,,,,,,,,,,,
224.84,-1.6,100,W0UPS,"Fort Collins, Buckhorn Mountain",CO,OPEN,,,12.94,W,,08,3660,40.61700058,-105.32700348,224.84,223.24,100,100,Larimer,Off-Air,"Wide Area: Northern CO Front Range and into Cheyenne - Laramie, WY",Northern Colorado ARC,"E-power, 25 watts.",,2019-08-23,,,,,,,,,,,,,,,,,,,,,,,,"Full-time to 447.70000 (W0UPS) at Fort Collins, Buckhorn Mountain, CO .",,,,,,,,,,,,,,,,,,,,,,,,,,,,,,,,,,,,,
449.575,-5,100,W0LRA,"Loveland, Namaqua Hill",CO,OPEN,,,12.97,S,,08,181,40.39780045,-105.0739975,449.575,444.575,100,,Larimer,On-Air,,Loveland Rptr Assoc,"Closed autopatch, e-power.",CCARC,2018-02-24,,,,,,,,,,,,,,,,,,,,,,,,,,,,,,,,,,,,,,,,,,,,,,,,,,,,,,,,,,,,,
927.875,-25.9,,KI0HC,"Fort Collins, Buckhorn Mountain",CO,OPEN,,,12.98,W,,08,18424,40.61669922,-105.32800293,927.875,902.025,,,Larimer,On-Air,"Wide area coverage, I 25 from Cheyenne south to MM 20 just north of Trinidad. I 76 East to MM 100. I 70 from Idaho Springs to Genoa. Highway 24 from the Colorado Springs to Limon. Highway 24 west of Colorado Springs is spotty to Hartsel. US 50 from Canon City to Las Animas. Salida south to the San Luis Valley to Antonito. Salida North to just south of Leadville. Repeater Coverage Map",RM Ham,,CCARC,2020-01-01,,,,,,,,,,,,,,,,,,,,,,,,Full-time to the The 900 P25 Network System .,,,,,,,,,,yes,293,yes,,,,,,,,,,,,,,,,,,,,,,,,,
147.195,0.6,100,W0LRA,"Loveland, Namaqua Hill",CO,OPEN,,,13.09,S,,08,179,40.39849854,-105.125,147.195,147.795,100,,Larimer,On-Air,,Loveland Repeater Assoc,"Closed autopatch, e-power.",CCARC,2016-08-18,,,,,,,,,,,,,,,,,,,,,,,,,,,,,,,,,,,,,,,,,,,,,,,,,,,,,,,,,,,,,
445.1375,-5,CC,KB0VGD,Greeley,CO,OPEN,,D,22.65,SE,,08,18521,40.42331314,-104.70912933,445.1375,440.1375,,,Weld,On-Air,,,,,2020-02-17,yes,2,c Record retrieved from radioid.net,,,,,,,,,,,,,,,,,,,,,,,,,,,,,,,,,,,,,,,,,,,,,,,,,,,,,,,,,,
449.325,-5,136.5,WR0AEN,Greeley,CO,OPEN,,S,22.66,SE,,08,8210,40.4233017,-104.70899963,449.325,444.325,,,Weld,On-Air,,Colorado Amateur Repeater Network (CARN),,CCARC,2012-11-12,,,,,,,,yes,WR0AEN (B),jfindu lookup / dstar-users lookup,,,,,,,,,,,,,,,,,,,,,,,,,,,,,,,,,,,,,,,,,,,,,,,,,,,
449.725,-5,127.3,K0OJ,"Greeley, UNC",CO,OPEN,,,23.63,SE,,08,159,40.40370178,-104.70300293,449.725,444.725,127.3,,Weld,On-Air,,K0OJ,"Autopatch, WX.",CCARC,2019-10-04,,,,,,,,,,,,,,,,,,,,,,,,,,,,,,,,,,,,,,,,,,,,,,,,,,,,,,,,,,,,,
146.85,-0.6,100,W0UPS,"Greeley, UNC",CO,OPEN,,,23.77,SE,,08,156,40.40359879,-104.69999695,146.85,146.25,100,100,Weld,On-Air,,Northern Colorado ARC,"E-power, WX.",CCARC,2017-05-08,,,,,,,,,,,,,,,,,,,,,,,,,,,,,,,,,,,,,,,,,,,,,,,,,,,,,,,,,,,,,
146.685,-0.6,123,N0FH,Estes Park,CO,OPEN,EI,,24.78,SW,ON - IDLE,08,119,40.36009979,-105.4509964,146.685,146.085,123,,Larimer,On-Air,Estes Valley and east RMNP - some coverage E and SE (Loveland and Denver),Estes Valley ARC,E-power.,CCARC,2017-08-05,,,,,,ARES D-10: Thu at 19:00.,,,,,DN70GI,"Both Echolink and IRLP are open, IRLP connect is a four digit node number only and '73' to disconnect. Top of Hour time is announced from 0600 to 2200.",625757,,,,,,,,,,,"Full-time to 449.80000 (N0FH) at Estes Park, CO .",,,,,"The EchoLink node connects to both machines. The node is open (no passwords; touch tone only the the ' * ' character followed by a four, five, or six digit node number where you wish to connect). The disconnect is ' # '.",,,,,,,,7268,,,,,,,,,,,,,,,,,,,,,,,,
449.8,-5,123,N0FH,Estes Park,CO,OPEN,EI,,27.1,WSW,ON - IDLE,08,120,40.37720108,-105.52100372,449.8,444.8,123,,Larimer,On-Air,,Estes Valley ARC,E-Power,CCARC,2017-08-05,,,,,,ARES D-10: Thu at 19:00.,,,,,,"Both Echolink and IRLP are open, IRLP connect is a four digit node number only and '73' to disconnect. Top of Hour time is announced from 0600 to 2200.",625757,,,,,,,,,,,"Full-time to 146.68500 (N0FH) at Estes Park, CO .",,,,,"The EchoLink node connects to both machines. The node is open (no passwords; touch tone only the the ' * ' character followed by a four, five, or six digit node number where you wish to connect). The disconnect is ' # '.",,,,,,,,7268,,,,,,,,,,,,,,,,,,,,,,,,
147.24,0.6,CC,N0WAR,"Estes Park, Prospect Mtn",CO,OPEN,,D,27.68,SW,"DMR BrandMeister Repeater in Estes Park, Colorado Wide area coverage of Estes Park, Colorado &amp; Rocky Mountain National Park. Static TG of 3171 on T.S. 2 Located @ KC0KBP QTH",08,17813,40.36059952,-105.51999664,147.24,147.84,,,Larimer,On-Air,Wide Area: Estes Park &amp; Rocky Mtn Nat Park,N0WAR,Brandmeister Network,,2019-11-27,yes,2,Brandmeister c Record retrieved from radioid.net,,W0DMR,,http://www.w0dmr.org,,,,DN70FI,,,310853,,,,,,,,,,,,,,,,,,,,,,,,,,,,,,,,,,,,,,,,,,,,,,,
448.525,-5,151.4,N0EPA,Longmont,CO,OPEN,E,,28.9,S,ON - IDLE,08,176,40.16719818,-105.10099792,448.525,443.525,151.4,,Boulder,On-Air,,N0EPA,,CCARC,2019-06-19,,,,,,,,,,,,,223853,,,,,,,,,,,,,,,,,,,,,,,,,,,,,,,,,,,,,,,,,,,,,,,,
147.27,0.6,100,W0ENO,Longmont,CO,OPEN,,,28.9,S,,08,175,40.16719818,-105.10099792,147.27,147.87,100,100,Boulder,On-Air,Wide area: Northern Colorado.,Longmont ARC (LARC),"Closed autopatch, e-power, EchoLink.",CCARC,2017-03-11,,,,,,,http://w0eno.org/?q=node/11,,,,,,,,,,,,,,,,,"Linkable to 448.80000 (W0ENO) at Longmont, CO .",,,,,,,,,,,,,,,,,,,,,,,,,,,,,,,,,,,,,
448.8,-5,88.5,W0ENO,Longmont,CO,OPEN,,,28.9,S,,08,177,40.16719818,-105.10099792,448.8,443.8,88.5,88.5,Boulder,On-Air,,Longmont ARC,30,CCARC,2017-03-11,,,,,,LARC: Sun at 20:00.,,,,,,,,,,,,,,,,,,"Linkable to 147.27000 (W0ENO) at Longmont, CO .",,,,,,,,,,,,,,,,,,,,,,,,,,,,,,,,,,,,,
147,0.6,100,KC0KWD,LaSalle,CO,OPEN,I,Y,29.95,SE,,08,157,40.26119995,-104.70600128,147,147.6,,,Weld,On-Air,,Weld ARS,"Yaesu System Fusion, 20 Watts. Will be switching to DSQ on 1 Feb 2016.",CCARC,2019-05-06,,,,,,Tuesday Night club net,,,,,DN70PG,,,,,,,,,,,,,,,,,,,,yes,Open ↑ / Open ↓,,,,,3839,,,,,,,,,,,,,,,,,,,,,,,,
448.475,-5,100,KC0KWD,Greeley,CO,OPEN,I,,29.95,SE,,08,158,40.26119995,-104.70600128,448.475,443.475,100,,Weld,On-Air,,Weld Amateur Radio Society (WARS),,CCARC,2019-05-06,,,,,,,http://www.warsco.org/,,,,DN70PG,,,,,,,,,,,,,,,,,,,,,,,,,,3839,,,,,,,,,,,,,,,,,,,,,,,,
447.6,-5,CC,W1VAN,"Red Feather Lakes, Red Feather Lakes",CO,OPEN,,D,31.87,WNW,Static Talkgroups: 3171 - N. Colorado - Slot 2 31083 - CO Severe WX - Slot 1,08,17821,40.80759811,-105.61699677,447.6,442.6,,,Larimer,On-Air,Covers Red Feather Lakes Area,W1VAN,Brandmeister Network,,2019-11-27,yes,2,brandmeister c Record retrieved from radioid.net,,W0DMR,,http://www.w0dmr.org,,,,,,,310869,,,,,,,,,,,,,,,,,,,,,,,,,,,,,,,,,,,,,,,,,,,,,,,
449.3,-5,131.8,N7JJY,"Cheyenne, Chalk Bluffs",WY,OPEN,,Y,34.34,NNE,,56,34,41.02740097,-104.78399658,449.3,444.3,,,Laramie,On-Air,"Laramie county wy, Northern Weld and Larimer County, CO",WU7G,,WRCG,2019-06-02,,,,,,,,,,,DN71OA,,,,,,,,,,,,,,,,,,,,yes,Open ↑ / Open ↓,,,,,,6.25,,,,,,,,,,,,,,,,,,,,,,,
449.9375,-5,CC,K7PFJ,"Cheyenne, South",WY,OPEN,,D,34.49,NNE,,56,15672,41.06000137,-104.87999725,449.9375,444.9375,,,Laramie,Off-Air,,,,WRCG,2020-02-04,yes,7,RMHR c Record retrieved from radioid.net,,,,https://www.rmham.org/wordpress/,,,,DN71NB,,,315603,"Open Talkgroup View Assignment TS TG Access Rocky Mountain Wide 1 700 Northern Colorado Regional 2 721 function myFunction(id) { var x = document.getElementById(id); if (x.className.indexOf(""w3-show"") == -1) { x.className += "" w3-show""; } else { x.className = x.className.replace("" w3-show"", """"); } }",,,,,,,1,2,Full-time to the Rocky Mountain Ham System .,,,,,,,,,,,,,,,RMHAM,,,,,,,,,,,,,,,,,,,,,,
147.03,0.6,100,KI0HG,"Allenspark, AFPD Station #5",CO,OPEN,,,34.95,SW,,08,15670,40.17269897,-105.46800232,147.03,147.63,100,,Boulder,On-Air,,KI0HG,,CCARC,2017-01-20,,,,,Boulder County Amateur Radio Emergency Service,,,,,,,,,,,,,,,,,,,,,,,,,,,,,,,,,,,,,,,,,,,,,,,,,,,,,,,,
146.76,-0.6,100,W0IA,"Boulder, Gunbarrel Hill",CO,OPEN,,,36.8,S,,08,16,40.05559921,-105.15699768,146.76,146.16,100,,Boulder,On-Air,Wide area.,Rocky Mtn VHF Soc,5,CCARC,2017-03-11,,,,,Boulder County ARES,,,,,,DN70KB,ARES primary repeater. Voting Receivers: RX Location Tone Pitch PL Gunbarrel single beep low 100.0 Lousville single beep low 100.0 Lyons double beep high followed by medium 100.0 Louisville #2 double beep high followed by low 100.0,,,,,,,,,,,,,,,,,,,,,,,,,,,,Tone,single beep,single beep,double beep,double beep,,,,,,,,,,,,,,,,,
224.96,-1.6,CSQ,AC0KC,Fort Lupton,CO,OPEN,,,37.42,SSE,,08,8183,40.08470154,-104.81300354,224.96,223.36,CSQ,,Weld,On-Air,,AC0KC,,CCARC,2012-11-12,,,,,,,,,,,,,,,,,,,,,,,,,,,,,,,,,,,,,,,,,,,,,,,,,,,,,,,,,,,,,
146.73,-0.6,91.5,K0DK,Boulder,CO,OPEN,E,,37.45,SSW,Node Offline,08,15,40.05709839,-105.24299622,146.73,146.13,91.5,91.5,Boulder,Off-Air,Local,BARC,12,CCARC,2017-05-02,,,,,,,http://www.ked-wireless.com/products1.htm,,,,DN70jb,,115482,,,,,,,,,,,,,,,,,,,,,,,,,,,,,,,,,,,,,,,,,,,,,,,,
445.05,-5,CC,N0SZ,"Boulder, Lee Hill",CO,OPEN,,D,38.2,SSW,,08,8992,40.07220078,-105.35399628,445.05,440.05,,,Boulder,On-Air,Wide area,Rocky Mountain Ham Radio,BrandMeister Network,CCARC,2019-11-27,yes,1,RMHR c Record retrieved from radioid.net,BrandMeister,,,,,,,,,,310852,,,,,,,,,,,,,,,,,,,,,,,,,BrandMeister US,,,,,,,,,,,,,,,,,,,,,,
446.9875,-5,CC,N0SZ,"Boulder, Lee Hill",CO,OPEN,,D,38.2,SSW,,08,5219,40.07220078,-105.35399628,446.9875,441.9875,,,Boulder,On-Air,,Rocky Mountain Ham Radio,Linked on Time Slot 2 to Almagre Mtn (446.950).,,2019-11-27,yes,7,RMHR c Record retrieved from radioid.net,,,,,,,,,,,310813,,,,,,,,,,"Full-time to 446.95000 (K7PFJ) at Colorado Springs, Almagre Mountain, CO . Full-time to the Colorado TRBO System .",,,,,,,,,,,,,,,,,,,,,,,,,,,,,,,,,,,,,
447.75,-5,141.3,N0SZ,"Boulder, Lee Hill",CO,OPEN,I,,38.2,SSW,,08,19,40.07220078,-105.35399628,447.75,442.75,141.3,141.3,Boulder,On-Air,,Rocky Mountain Ham Radio,,CCARC,2018-04-24,,,,,,,,,,,,,,,,,,,,,,,,,,,,,,,,,,,,,3450,,,,,,,,,,,,,,,,,,,,,,,,
145.46,-0.6,107.2,W0CRA,"Boulder, Eldorado Mountain",CO,OPEN,EI,,38.2,SSW,ON - IDLE,08,8,40.07220078,-105.35399628,145.46,144.86,107.2,107.2,Boulder,On-Air,Boulder/Denver Metro,Colorado Repeater Association (CRA),"Closed autopatch, e-power.",CCARC,2017-11-13,,,,,CRA VHF Link System,,,,,,,,347086,,,,,,,,,,,"Full-time to 145.16000 (W0CRA) at Colorado Springs, Cheyenne Mountain, CO . Full-time to 147.22500 (W0CRA) at Larkspur, Westcreek, CO .",,,,,Member-only IRLP and Echolink node,,,,,,,,3990,,,,,,,,,,,,,,,,,,,,,,,,
447.975,-5,107.2,W0CRA,"Boulder, Eldorado Mountain",CO,OPEN,,,38.2,SSW,,08,20,40.07220078,-105.35399628,447.975,442.975,107.2,107.2,Boulder,On-Air,Wide area: Boulder/Longmont area.,Colorado Repeater Association (CRA),Closed autopatch.,CCARC,2016-09-08,,,,,,,,,,,DN70HB,,,,,,,,,,,,,,,,,,,,,,,,,,,,,,,,,,,,,,,,,,,,,,,,,,
224.02,-1.6,,W0IA,"Boulder, Lee Hill",CO,OPEN,E,,38.2,SSW,ON - IDLE,08,18,40.07220078,-105.35399628,224.02,222.42,,,Boulder,On-Air,Denver metro area.,Rocky Mtn VHF Soc,8,CCARC,2017-03-11,,,,,,,RMVHS repeaters,,,,DN70HB,,217336,,,,,,,,,,,"Full-time to 449.55000 (W0IA) at Boulder, CO .",,,,,,,,,,,,,,,,,,,,,,,,,,,,,,,,,,,,,
145.3875,-0.6,,KC0DS,Boulder,CO,OPEN,,S,38.65,SSW,,08,8171,40.03720093,-105.23000336,145.3875,144.7875,,,Boulder,On-Air,20,Boulder County ARES,E-power.,CCARC,2012-11-12,,,,,,,http://bouldercountyares.org/technical/d-star,yes,KC0DS (C),jfindu lookup / dstar-users lookup,,,,,,,,,,,,,,,,,,,,,,,,,,,,,,,,,,,,,,,,,,,,,,,,,,,
1283.8625,-20,,KC0DS,Boulder,CO,OPEN,,S,38.65,SSW,,08,8220,40.03720093,-105.23000336,1283.8625,1263.8625,,,Boulder,On-Air,20,Boulder County ARES,E-power.,CCARC,2013-12-21,,,,,,,,yes,KC0DS (A) Repeater,jfindu lookup / dstar-users lookup,DN70JA,,,,,,,,,,,,,,,,,,,,,,,,,,,,,,,,,,,,,,,,,,,,,,,,,,
146.775,-0.6,114.8,KC7SNO,"Cheyenne, Denver Hill",WY,OPEN,,,39.71,NNE,,56,27,41.12390137,-104.81900024,146.775,146.175,114.8,,Laramie,On-Air,,Shy-Wy Amateur Radio Club,"E-power, WX.",WRCG,2017-01-04,,,,,,Weather Net: Daily at 06:45. Shy-WY ARC: Sun at 07:00.,,,,,,,,,,,,,,,,,,"Full-time to 147.16500 (KC7SNO) at Albin, WY .",,,,,,,,,,,,,,,,,,,,,,,,,,,,,,,,,,,,,
448.15,-5,100,KB7SWR,Cheyenne,WY,OPEN,,,39.84,N,,56,20,41.15250015,-105.22100067,448.15,443.15,100,,Laramie,Off-Air,,KB7SWR,,WRCG,2017-01-04,,,,,,,,,,,DN71JD,,,,,,,,,,,,,"Full-time to 145.23500 (KB7SWR) at Cheyenne, WY .",,,,,,,,,,,,,,,,,,,,,,,,,,,,,,,,,,,,,
146.91,0.6,123,W0JZ,Gold Hill,CO,OPEN,,,39.95,SSW,,08,13368,40.06330109,-105.41000366,146.91,147.51,123,127.3,Boulder,On-Air,"East of Gold Hill, The Indian Peaks, Denver, Boulder",,,,2017-04-09,,,,,"Town of Gold Hill, Colorado","Summer Tue at 19:30P, Winter 19:00.",http://goldhilltown.com/,,,,,There is a MOU With BCARES for repeater use.,,,,,,,,,,,,,,,,,,,,,,,,,,,,,,,,,,,,,,,,,,,,,,,,,
449.4,-5,91.5,K0DK,Boulder,CO,OPEN,,,40.61,SSW,,08,21,40.01499939,-105.26999664,449.4,444.4,91.5,,Boulder,Off-Air,,BARC,2,CCARC,2013-01-08,,,,,,,http://www.ked-wireless.com/products1.htm,,,,,,,,,,,,,,,,,,,,,,,,,,,,,,,,,,,,,,,,,,,,,,,,,,,,,,
449.55,-5,100,W0IA,Boulder,CO,OPEN,E,,40.61,SSW,ON - IDLE,08,11,40.01499939,-105.26999664,449.55,444.55,100,,Boulder,On-Air,Denver metro area.,Rocky Mtn VHF Soc,8,CCARC,2017-03-11,,,,,,,,,,,,,217336,,,,,,,,,,,"Full-time to 224.02000 (W0IA) at Boulder, Lee Hill, CO .",,,,,,,,,,,,,,,,,,,,,,,,,,,,,,,,,,,,,
446.8625,-5,,KC0DS,Boulder,CO,OPEN,,S,40.62,SSW,,08,8186,40.01499939,-105.27100372,446.8625,441.8625,,,Boulder,On-Air,,Boulder County ARES,,CCARC,2017-03-11,,,,,,,,yes,KC0DS (B),jfindu lookup / dstar-users lookup,,,,,,,,,,,,,,,,,,,,,,,,,,,,,,,,,,,,,,,,,,,,,,,,,,,
446.8,-5,CC,N0SZ,"Boulder, Mount Thorodin",CO,OPEN,,D,40.62,SSW,,08,8185,40.01499939,-105.27100372,446.8,441.8,,,Boulder,On-Air,Wide area.,Rocky Mountain Ham Radio,,CCARC,2019-11-27,yes,7,RMHR c Record retrieved from radioid.net,,Rocky Mountain Ham Radio,,Rocky Mountain Ham Radio,,,,,See website for complete information regarding timeslot/colorcode/talkgroup programming.,,310800,,,,,,,,,,Full-time to the Colorado TRBO System .,,,,,,,,,,,,,,,,,,,,,,,,,,,,,,,,,,,,,
1299.5,-20,,W0DK,Boulder,CO,OPEN,,S,40.62,SSW,,08,8221,40.01499939,-105.27100372,1299.5,1279.5,,,Boulder,On-Air,,Boulder County ARES,E-power.,CCARC,2012-11-12,,,,,,,,yes,W0DK (A) DVAP 24/7,jfindu lookup / dstar-users lookup,,,,,,,,,,,,,,,,,,,,,,,,,,,,,,,,,,,,,,,,,,,,,,,,,,,
145.235,-0.6,131.8,KB7SWR,Cheyenne,WY,OPEN,,,40.74,NNE,,56,19,41.13999939,-104.81999969,145.235,144.635,131.8,,Laramie,On-Air,Local: Cheyenne.,N7GT,,WRCG,2019-10-23,,,,,,,,,,,,25,,,,,,,,,,,,"Full-time to 448.15000 (KB7SWR) at Cheyenne, WY .",,,,,,,,,,,,,,,,,,,,,,,,,,,,,,,,,,,,,
