Frequency,Offset,Tone,Call,Location,ST/PR,Use,VOIP,DGTL,Mi,Dir,,state_id,ID,Latitude,Longitude,Downlink,Uplink,Uplink Tone,Downlink Tone,County,Op Status,Coverage,Sponsor,Features,Coordination,Last update,DMR Enabled,Color Code,IPSC Network,Wide Network,Affiliate,Nets,Web links,D-STAR Enabled,Node,Sources,Grid,Notes,EchoLink,DMR ID,Talkgroups,Worldwide,North America,English,TAC 310,Local/Cluster,N. Colorado,Rocky Mountain Wide,Northern Colorado Regional,Links,Talkgroup Network,Worldwide English,DCI Bridge,Colorado,Commands,Mountain Reg USA,YSF Digital Enabled,DG-ID,Mixed-Mode,P-25 Digital Enabled,NAC,Default Reflector,IRLP,Bandwidth,Local Network,RX Location,Gunbarrel,Lousville,Lyons,Louisville #2,AllStar,Wyoming,WyLOCAL,On-air,Feed,WIRES-X,Southern Colorado,Central Regional,Devilshead Local,NXDN Enabled,RAN,NXDN Bandwidth,NXDN Network,Eastern Colorado,TAC 311,Colorado Chat,Location Photo
147.105,0.6,91.5,KC7SNO,"Cheyenne, North Park",WY,OPEN,,,40.74,NNE,,56,26,41.13999939,-104.81999969,147.105,147.705,91.5,91.5,Laramie,On-Air,,ShyWyArc,,WRCG,2019-02-15,,,,,,,,,,,DN71,,,,,,,,,,,,,,,,,,,,,,,,,,,,,,,,,,,,,,,,,,,,,,,,,,
449.9,-5,100,N7JJY,Cheyenne,WY,OPEN,,,40.74,NNE,,56,15518,41.13999939,-104.81999969,449.9,444.9,100,100,Laramie,On-Air,From 5 miles to 25 miles,N7JJY,,,2017-01-04,,,,,,,,,,,,To be used as a portable repeater for ARES/RACES or as needed for specific needs of the Amateur Community in Laramie County or other areas as needed. Repeater will be on when needed otherwise offline.,,,,,,,,,,,,,,,,,,,,,,,,,,,,,,,,,,,,,,,,,,,,,,,,,
449.975,-5,CC,WY7EOC,Cheyenne,WY,OPEN,,D,40.74,NNE,,56,10803,41.13999939,-104.81999969,449.975,444.975,,,Laramie,On-Air,,WY7EOC,,WRCG,2020-02-27,yes,11,WyDMR c Record retrieved from radioid.net,,Laramie County Emergency Management/WY7EOC,,,,,,,See the website for TG/TS/CC programming info and link status/info,,315601,,,,,,,,,,,,,,,,,,,,,,,,,Wyoming DMR Project,,,,,,,,,,,,,,,,,,,,,,
447.3,-5,107.2,AC0KC,Fort Lupton,CO,OPEN,EI,,41.55,SSE,Node Offline,08,8739,40.02759933,-104.78900146,447.3,442.3,107.2,,Weld,On-Air,,,,CCARC,2013-01-07,,,,,,,,,,,,,405804,,,,,,,,,,,,,,,,,,,,,,,,3887,,,,,,,,,,,,,,,,,,,,,,,,
448.95,-5,CC,KC7DHF,"Cheyenne, Old airport control tower",WY,OPEN,,D,41.62,NNE,"Cheyenne DMR Repeater. Please use ONLY TG 315615(Cheyenne Local), TG 31563 (Wy Svr Wx), and TG 31562 (Wyoming TAC 2) on Time Slot 2 (TS2). TG 3156 (Wyoming), TG 31560 (SE Wyoming ) and TG 31561 (Wyoming TAC 1) are on TS1. ALL OTHER TG connections will be directed to Time Slot 1 (TS1). Example of ALL OTHERS is any calls that are to a TG outside of Wyoming. Under special situations such as emergencies or special events TS2 may be used for TGs outside of Wyoming but those will be after repeater Admin approval.",56,8991,41.15299988,-104.81800079,448.95,443.95,,,Laramie,On-Air,Local,,,WRCG,2019-12-12,yes,15,Brandmeister c Record retrieved from radioid.net,BrandMeister,,,,,,,DN71OD,Brandmiester DMR only no analog.,,315615,,,,,,,,,,,,,,,,,,,,,,,,,Brandmeister,,,,,,,,,,,,,,,,,,,,,,
423,820,ATV,W0BTV,Boulder,CO,OPEN,,,43.11,SSW,,08,18534,39.97848511,-105.27445221,423,1243,ATV,,Boulder,On-Air,"Wide Area, WY border to DIA to SE Denver",BATVC,"dual-mode, NTSC analog &amp; DVB-T digital ATV",,2020-02-25,,,,,ATN,"ATV, Thurs, 3pm local",https://kh6htv.com/,,,,,,,,,,,,,,,,,,,,,,,,,,,,,,,,,,,,,,,,,,,,,,,,,,,,,,
146.61,-0.6,100,W0DK,Boulder,CO,OPEN,I,,43.13,SSW,,08,13,39.97829819,-105.27500153,146.61,146.01,100,,Boulder,On-Air,,Boulder Amateur Radio Club,,CCARC,2019-08-23,,,,,,,,,,,,,,,,,,,,,,,,,,,,,,,,,,,,,7007,,,,,,,,,,,,,,,,,,,,,,,,
448.9,-5,100,W0DK,"Boulder, Table Mesa",CO,OPEN,,,43.15,SSW,,08,10,39.97800064,-105.27500153,448.9,443.9,100,,Boulder,On-Air,"Wyoming border in the north, to Monument Hill in the south, near Colorado Springs. Its coverage is primarily to the east of the Front Range of the Rockies as the repeater signal is blocked to the west by the even higher Rocky Mountain peaks with altitudes of over 14,000 feet.",Boulder ARC,6,CCARC,2013-03-17,,,,,,,,,,,,,,,,,,,,,,,,,,,,,,,,,,,,,,,,,,,,,,,,,,,,,,,,,,,,,
146.7,-0.6,100,W0DK,"Boulder, Table Mountain",CO,OPEN,,,43.24,SSW,,08,14,39.97750092,-105.27899933,146.7,146.1,100,,Boulder,On-Air,"Wyoming border in the north, to Monument Hill (near Colorado Springs) in the south. Coverage is primarily to the east of the Rockies Front Range, as the repeater signal is blocked to the west by mountain peaks with altitudes of over 14,000 feet.",Boulder Co ARC,6,CCARC,2013-03-17,,,,,,,BARC Repeaters,,,,,,,,,,,,,,,,,,,,,,,,,,,,,,,,,,,,,,,,,,,,,,,,,,,,,,
447.625,-5,100,KE0SJ,Lochbuie,CO,OPEN,,,44.4,SSE,,08,9771,40.00719833,-104.71600342,447.625,442.625,100,,Adams,On-Air,Local/North Metro,Intermountain Repeater Group,,,2015-05-23,,,,,,,Intermountain Repeater Group,,,,,,,,,,,,,,,,,,,,,,,,,,,,,,,,,,,,,,,,,,,,,,,,,,,,,,
449.925,-5,114.8,K0EB,Hudson,CO,OPEN,EI,,45.47,SSE,Node Offline,08,8216,40.02019882,-104.64199829,449.925,444.925,114.8,114.8,Weld,On-Air,,K0EB,,CCARC,2018-12-01,,,,,K0UPS Club,,,,,,DN70,,448035,,,,,,,,,,,,,,,,,,,,,,,,8035,,,,,,,,,,,,,,,,,,,,,,,,
448.925,-5,131.8,W0LMA,Broomfield,CO,OPEN,,,45.93,S,,08,26,39.92060089,-105.08599854,448.925,443.925,131.8,,Boulder,Off-Air,,W0LMA,,CCARC,2019-06-19,,,,,,,,,,,,,,,,,,,,,,,,,,,,,,,,,,,,,,,,,,,,,,,,,,,,,,,,,,,,,
449.825,-5,103.5,W0WYX,Broomfield,CO,OPEN,,,45.93,S,,08,266,39.92060089,-105.08599854,449.825,444.825,103.5,,Boulder,Off-Air,Along the foothills and into Boulder where the 94 repeater is shadowed.,Rocky Mountain Radio League,6,CCARC,2019-06-19,,,,,,Colorado WX: Daily at 06:30. RMRL: Mod at 20:30. Astronomy: Tue at 19:00. Amateur Radio Events: Tue at 20:00.,Repeater,,,,,,,,,,,,,,,,,,,,,,,,,,,,,,,,,,,,,,,,,,,,,,,,,,,,,,
449.425,-5,103.5,WC3W,Grand Lake,CO,OPEN,A,,46.73,WSW,,08,18131,40.23920059,-105.84700012,449.425,444.425,103.5,103.5,Clear Creek,On-Air,"Grand Lake, CO",,,,2019-09-21,,,,,,Sunday and Tuesday nights at 7 PM MT,,,,,,Linked to the Allstar Florida Hub,,,,,,,,,,,,,,,,,,,,,,,,,,,,,,,,,45202,,,,,,,,,,,,,,,,
147.045,0.6,123,K0ML,Northglenn,CO,OPEN,,,48.62,S,,08,185,39.88560104,-104.98699951,147.045,147.645,123,,Adams,On-Air,,Northglenn RA,E-power.,CCARC,2017-04-10,,,,,,,,,,,,,,,,,,,,,,,,,,,,,,,,,,,,,,,,,,,,,,,,,,,,,,,,,,,,,
447.225,-5,CC,WY7EOC,"Laramie, Pilot Hill",WY,CLOSED,,D,50.48,NNW,,56,60,41.26660156,-105.43299866,447.225,442.225,,,Albany,On-Air,Wide area.,Laramie County EM,,WRCG,2019-12-12,yes,11,WyDMR c Record retrieved from radioid.net,,Wyoming DMR Project,,,,,,DN71GG,,,315608,"Open Talkgroup View Assignment TS TG Access Wyoming 1 3156 Full-Time WyLOCAL 2 100 Full-Time function myFunction(id) { var x = document.getElementById(id); if (x.className.indexOf(""w3-show"") == -1) { x.className += "" w3-show""; } else { x.className = x.className.replace("" w3-show"", """"); } }",,,,,,,,,,Wyoming DMR Project,,,,,,,,,,,,,,Wyoming DMR Project,,,,,,,1,2,,,,,,,,,,,,,,
224.6,-1.6,100,W0RM,Rollinsville,CO,OPEN,,,51.13,SSW,,08,201,39.91719818,-105.50099945,224.6,223,100,,Gilpin,,,W0RM,,CCARC,2012-11-10,,,,,,,,,,,,,,,,,,,,,,,,,,,,,,,,,,,,,,,,,,,,,,,,Unknown,,,,,,,,,,,,,
145.31,-0.6,88.5,KB0VJJ,"Boulder, Thorodin Mountain",CO,OPEN,,,51.48,SSW,,08,72,39.88750076,-105.4260025,145.31,144.71,88.5,123,Gilpin,On-Air,"Wide area: Cheyenne, Wyoming to the north, Monument, Colorado to the south, Limon, Colorado to the east, and the continental divide to the west.",Colorado Connection,10,CCARC,2019-08-15,,,,,,Colorado Traffic Net: Daily at 19:30. Colorado Connection Net (all welcome): Thu at 20:00. Statewide ARES: Sun at 20:00.,,,,,DM79GV,"Split tone. The repeater still transmits 123.0 for those wishing to use tone squelch, you must run a split tone 88.5 TX and 123.0 RX",,,,,,,,,,,,Full-time to the Colorado Connection System .,,,,,,,,,,,,,,,,,,,,,,,,,,,,,,,,,,,,,
449.225,-5,141.3,N0SZ,"Denver, Thorodin Mountain",CO,OPEN,,,51.48,SSW,,08,97,39.88750076,-105.4260025,449.225,444.225,141.3,141.3,Gilpin,On-Air,Wide area.,Rocky Mountain Ham Radio (RMHR),Emergency Power,CCARC,2015-11-03,,,,,,,,,,,DM79GV,"Emcomm Affiliated, Open repeater",,,,,,,,,,,,,,,,,,,,,,,,,,,,,,,,,,,,,,,,,,,,,,,,,
449.3,-5,100,N1UPS,Westminster,CO,OPEN,EI,,51.79,S,ON - In Conference IRLP 3946,08,8208,39.83670044,-105.03700256,449.3,444.3,100,,Adams,On-Air,,N1UPS,,CCARC,2017-04-24,,,,,,,,,,,,,43699,,,,,,,,,,,,,,,,,,,,,,,,3699,,,,,,,,,,,,,,,,,,,,,,,,
53.03,-1,,K7UWR,"Laramie, Pilot Hill",WY,OPEN,,,53.68,NNW,,56,4,41.30979919,-105.45500183,53.03,52.03,,,Albany,Off-Air,I-80 from west of Laramie to east of Cheyenne for 25 watt mobiles with 1/4 wave antenna.,K7UWR,8,,2017-01-04,,,,,,,http://www.r-vcr.com/k7uwr/repeater.htm,,,,DN71GH,,,,,,,,,,,,,,,,,,,,,,,,,,,,,,,,,,,,,,,,,,,,,,,,,,
446.975,-5,CC,KB0VGD,"Golden, Table Mountain",CO,OPEN,,D,55.76,S,"KB0VGD North Table Mtn. Golden Wide area coverage. Please use ONLY TG 310811, TG 3171, TG 3108, and TG 2 (Local 2) on Time Slot 2 (TS2). ALL OTHER TG connections will be directed to Time Slot 1 (TS1).",08,14273,39.7845993,-105.21600342,446.975,441.975,,,Jefferson,On-Air,Denver Metro Area,W0DMR,,,2019-11-27,yes,2,NoCo c Record retrieved from radioid.net,,,"Tac 310 Net, Sundays 18:00 Mountain Time, TS1, TG 310.",http://www.w0dmr.org/,,,,,,,310811,,,,,,,,,,,,,,,"TS 1, CC 2: TG 3171 - Northern Colorado Network, TG 3100 - DCI Bridge, TG 1776 - USA Network, TG 310 - Tac 310. TS 2, CC 2: TG 2 - Local",,,,,,,,,,,,,,,,,,,,,,,,,,,,,,,,
146.61,-0.6,,N7UW,"Laramie, University",WY,OPEN,,Y,56.71,NNW,,56,76,41.31480026,-105.58200073,146.61,146.01,,,Albany,On-Air,Laramie Valley 30 mi radius.,University ARC,,WRCG,2017-01-04,,,,,,,http://www.uwyo.edu/uarc,,,,DN71FH,,,,,,,,,,,,,,,,,,,,yes,Open ↑ / Open ↓,Yes; analog capable.,,,,,,,,,,,,,,,,,,,,,,,,,,,,
146.82,-0.6,114.8,KC7SNO,"Laramie, Beacon Hill",WY,OPEN,,,56.72,NNW,,56,9,41.31140137,-105.59100342,146.82,146.22,114.8,,Albany,On-Air,Wide area.,Shy-Wy Amateur Radio Club,,WRCG,2019-06-13,,,,,,Shy-WY ARC: Thu at 19:00.,,,,,,,,,,,,,,,,,,,,,,,,,,,,,,,,,,,,,,,,,,,,,,,,,,,,,,,
446.875,-5,CC,K7PFJ,"Granby, Mt Chauncey",CO,OPEN,,D,56.73,SW,,08,15899,40.08610153,-105.93900299,446.875,441.875,,,Clear Creek,On-Air,,,,,2019-11-27,yes,7,RMHAM c Record retrieved from radioid.net,,RMHAM,,http://www.rmham.org,,,,,,,310838,,,,,,,,,,,,,,,,,,,,,,,,,,,,,,,,,,,,,,,,,,,,,,,
146.82,-0.6,123,KA0YDW,Granby,CO,OPEN,,,56.73,SW,,08,145,40.08610153,-105.93900299,146.82,146.22,123,,Grand,,,GCARA,E-power.,CCARC,2014-09-06,,,,,,,,,,,,,,,,,,,,,,,,,,,,,,,,,,,,,,,,,,,,,,,,Unknown,,,,,,,,,,,,,
449.75,-5,103.5,KI0GO,"Golden, Guy Hill",CO,OPEN,,,57.3,SSW,,08,265,39.77719879,-105.32800293,449.75,444.75,103.5,103.5,Jefferson,On-Air,,Rocky Mtn Radio League,8,CCARC,2016-12-23,,,,,,,Repeater,,,,,,,,,,,,,,,,,,,,,,,,,,,,,,,,,,,,,,,,,,,,,,,,,,,,,,
224.74,-1.6,88.5,N0POH,"Golden, Guy Hill",CO,OPEN,,,57.3,SSW,,08,134,39.77719879,-105.32800293,224.74,223.14,88.5,88.5,Jefferson,On-Air,,Aurora Repeater Assoc,e-power,CCARC,2016-01-17,,,,,,ARA: Wed at 2000.,ARA Repeaters,,,,,,,,,,,,,,,,,,,,,,,,,,,,,,,,,,,,,,,,,,,,,,,,,,,,,,
448.15,-5,141.3,WE0FUN,"Denver, Green Valley Ranch",CO,OPEN,EA,,57.3,SSE,Node Offline,08,9765,39.79669952,-104.7480011,448.15,443.15,141.3,141.3,Denver,On-Air,Small coverage of the East Denver area SW of DIA. Repeater Coverage Map,K0GUR,E-power (batt). 2 meter and 70cm channel steerable remote bases.,CCARC,2019-08-22,,,,,,APRS Net: Sun at 19:00. Region 5 District 2 ARES Net: Sun at 19:30. Statewide ARES Net: Sun at 20:00. Region 5 District 1 ARES Net: Mon at 19:00. RGARC Net: Wed at 19:00.,k0jsc.com,,,,DM79pt,Can be linked to various local repeater systems via the remote base(s). Echolink connects restricted. Email me to be added to the authorized list. The system may be occupied in the Southern Colorado area for a formal net or ARES activity.,24340,,,,,,,,,,,Full-time to the The Fun Machine System .,,,,,,,,,,,,,,,,,,,,,29436,,,,Listen Live,,,,,,,,,,,,
145.22,-0.6,103.5,WT0C,"Golden, Guy Hill",CO,OPEN,,,57.3,SSW,,08,71,39.77719879,-105.32800293,145.22,144.62,103.5,103.5,Jefferson,On-Air,Wide area.,Rocky Mtn Radio League,8,CCARC,2016-12-23,,,,,,,Repeater,,,,,Talk-Group of $FFFF.,,,,,,,,,,,,,,,,,,,,,Yes; analog capable.,yes,293,yes,,,,,,,,,,,,,,,,,,,,,,,,,
448.85,-5,88.5,K0IBM,"Golden, Guy Hill",CO,OPEN,,,57.32,SSW,,08,136,39.77719879,-105.32900238,448.85,443.85,88.5,88.5,Jefferson,On-Air,"Denver metro, central front range",Aurora Repeater Assoc,e-power.,CCARC,2016-01-17,,,,,,ARA: Wed at 20:00.,ARA Repeaters,,,,DM79IS,,,,,,,,,,,,,,,,,,,,,,,,,,,,,,,,,,,,,,,,,,,,,,,,,,
224,-1.6,103.5,N0MHU,"Golden, Guy Hill",CO,OPEN,,,57.32,SSW,,08,86,39.77719879,-105.32900238,224,222.4,103.5,103.5,Jefferson,On-Air,,Rocky Mountain Radio League,8,CCARC,2017-03-11,,,,,,,Repeater,,,,,,,,,,,,,,,,,,,,,,,,,,,,,,,,,,,,,,,,,,,,,,,,,,,,,,
147.15,0.6,100,W0CBI,"Golden, Guy Hill",CO,OPEN,,,57.32,SSW,,08,133,39.77719879,-105.32900238,147.15,147.75,100,100,Jefferson,On-Air,"Denver metro, central front range",Aurora Repeater Assoc (ARA),e-power,CCARC,2016-01-17,,,,,,ARA: Wed at 20:00.,ARA Repeaters,,,,DM79IS,,,,,,,,,,,,,"Linkable to 224.74000 (N0POH) at Golden, Guy Hill, CO .",,,,,,,,,,,,,,,,,,,,,,,,,,,,,,,,,,,,,
447.175,-5,100,W0JRL,"Denver, Broadway Plaza Lofts",CO,OPEN,EA,,57.59,S,ON - IDLE,08,12216,39.75519943,-104.98699951,447.175,442.175,100,100,Denver,On-Air,,W0JRL,,CCARC,2015-05-15,,,,,,,,,,,DM79MS,,201712,,,,,,,,,,,,,,,,Standard AllStar Link access commands.,,,,,,,,,,,,,,,,29997,,,,,,,,,,,,,,,,
448.35,-5,225.7,KD0SSP,"Lakewood, Moffat Treatment Plant",CO,OPEN,,Y,57.71,S,,08,17349,39.75059891,-105.1230011,448.35,443.35,,,Jefferson,On-Air,Denver Metro and surrounding,Denver Water Amateur Radio Club (DWARC),,CCARC,2018-10-02,,,,,,,http://www.DWARC.com,,,,,,,,,,,,,,,,,,,,,,,,yes,Open ↑ / Open ↓,,,,,,,,,,,,,,,,,,,,,,,,,,,,,
147.21,0.6,100,KD0SSP,"Lakewood, Moffat Treatment Plant",CO,OPEN,I,,57.72,S,,08,9775,39.75049973,-105.1230011,147.21,147.81,100,100,Jefferson,On-Air,,Denver Water Amateur Radio Club,,,2020-01-23,,,,,,,http://www.dwarc.com,,,,DM79KS,,,,,,,,,,,,,,,,,,,,,,Yes; analog capable.,,,,3241,,,,,,,,,,,,,,,,,,,,,,,,
448.125,-5,107.2,N0PYY,Golden,CO,OPEN,,,57.78,S,,08,143,39.75559998,-105.22100067,448.125,443.125,107.2,,Jefferson,On-Air,,Denver PD EEB,,CCARC,2014-04-28,,,,,,,,,,,,,,,,,,,,,,,,,,,,,,,,,,,,,,,,,,,,,,,,,,,,,,,,,,,,,
448.975,-5,123,W0GV,Golden,CO,OPEN,A,,57.78,S,,08,137,39.75559998,-105.22100067,448.975,443.975,123,,Jefferson,On-Air,Wide area.,FRG,Linkable VHF/UHF Remote Base,CCARC,2019-09-06,,,,,,,,,,,,,,,,,,,,,,,,,,,,,,,,,,,,,,,,,,,,,42845,,,,,,,,,,,,,,,,
927.7875,-25,156.7,N0PYY,Golden,CO,OPEN,,,57.79,S,,08,7170,39.75550079,-105.22100067,927.7875,902.7875,156.7,,Jefferson,On-Air,Golden and Denver.,N0PYY,,,2017-12-24,,,,,,,,,,,,,,,,,,,,,,,,,,,,,,,,,,,,,,,,,,,,,,,,,,,,,,,,,,,,,
447.45,-5,103.5,WA4CCC,Winter Park,CO,OPEN,,,57.87,SW,,08,3756,39.94729996,-105.79499817,447.45,442.45,103.5,,Grand,On-Air,,W0IG,,CCARC,2013-10-26,,,,,,,,,,,DM79CW,,,,,,,,,,,,,,,,,,,,,,,,,,,,,,,,,,,,,,,,,,,,,,,,,,
927.8375,-25.8,D205,KI0HC,"Golden, Centennial Cone",CO,OPEN,,,58.55,SSW,,08,9702,39.76580048,-105.36599731,927.8375,902.025,D205,100,Jefferson,On-Air,"Wide area coverage, I 25 from Cheyenne south to MM 20 just north of Trinidad. I 76 East to MM 100. I 70 from Idaho Springs to Genoa. Highway 24 from the Colorado Springs to Limon. Highway 24 west of Colorado Springs is spotty to Hartsel. US 50 from Canon City to Las Animas. Salida south to the San Luis Valley to Antonito. Salida North to just south of Leadville. Repeater Coverage Map",,,CCARC,2020-01-01,,,,,,,,,,,DM79HS,,,,,,,,,,,,,Full-time to the The 900 P25 Network System .,,,,,,,,,Yes; analog capable.,yes,293,yes,,,,,,,,,,,,,,,,,,,,,,,,,
446.7875,-5,CC,W0TX,"Denver, Centennial Cone",CO,OPEN,,D,58.56,SSW,,08,7165,39.76570129,-105.36599731,446.7875,441.7875,,,Jefferson,On-Air,,Denver Radio Club,,CCARC,2019-11-27,yes,1,DMR-MARC c Record retrieved from radioid.net,,Brandmeister Network,,http://www.w0tx.org/,,,,,,,310804,,,,,,,,,,,,,,,"Any Brandmeister talk group is available on time slot 1, too many to list here, see website. https://dmrx.net/files/US_BM_User_Guide.pdf. TG's are PTT enabled and will timeout after 15 minutes of inactivity. Time Slot 2 Talk Group 310805 is local repeater only.",,,,,,,,,,,,,,,,,,,,,,,,,,,,,,,,
147.015,0.6,146.2,N7UW,"Laramie, Jelm Mountain",WY,OPEN,E,Y,58.57,NW,Node Offline,56,15436,41.09719849,-105.97699738,147.015,147.615,146.2,,Albany,On-Air,Albany County,"Albany County ARES/RACES, University Amateur Radio",,,2017-02-24,,,,,,,http://www.uwyo.edu/uarc/,,,,,,82070,,,,,,,,,,,,,,,,,,yes,Open ↑ / Open ↓,Yes; analog capable.,,,,,,,,,,,,,,,,,,,,,,,,,,,,
145.475,-0.6,100,KE0SJ,"Boulder, Blue Mountain",CO,OPEN,,,58.7,S,,08,75,39.73920059,-104.98400116,145.475,144.875,100,,Jefferson,On-Air,"Wide Area: Ft. Collins to the North, Colorado Springs to the South, Parts of Akron to the east.",Intermountain Repeater Group,E-power.,CCARC,2015-05-22,,,,,,,Intermountain Repeater Group,,,,,,,,,,,,,,,,,,,,,,,,,,,,,,,,,,,,,,,,,,,,,,,,,,,,,,
146.715,-0.6,123,N0JXN,Denver,CO,OPEN,,,58.7,S,,08,79,39.73920059,-104.98400116,146.715,146.115,123,123,Denver,On-Air,,EARS,E-power.,CCARC,2017-04-09,,,,,,,,,,,,,,,,,,,,,,,,,,,,,,,,,,,,,,,,,,,,,,,,,,,,,,,,,,,,,
448.075,-5,123,N5EHP,Denver,CO,OPEN,,,58.7,S,,08,91,39.73920059,-104.98400116,448.075,443.075,123,,Denver,On-Air,,W0IG,,CCARC,2017-03-11,,,,,,,,,,,,,,,,,,,,,,,,,,,,,,,,,,,,,,,,,,,,,,,,,,,,,,,,,,,,,
448.55,-5,82.5,W0KIZ,Denver,CO,OPEN,,,58.7,S,,08,93,39.73920059,-104.98400116,448.55,443.55,82.5,,Denver,Off-Air,,HPRA,E-power.,CCARC,2017-03-11,,,,,,,,,,,,,,,,,,,,,,,,,,,,,,,,,,,,,,,,,,,,,,,,,,,,,,,,,,,,,
447.925,-5,100,K0FEZ,Denver,CO,OPEN,,,58.81,S,,08,8196,39.73759842,-104.98500061,447.925,442.925,100,100,Denver,On-Air,,RADOPS El Jebel Shriners,,CCARC,2014-07-03,,,,,,,,,,,,,,,,,,,,,,,,,,,,,,,,,,,,,,,,,,,,,,,,,,,,,,,,,,,,,
447.9,-5,CSQ,WB0TPT,Denver,CO,OPEN,,,58.81,S,,08,8195,39.73759842,-104.98500061,447.9,442.9,CSQ,,Denver,Off-Air,,WB0TPT,,CCARC,2017-03-11,,,,,,,,,,,,,,,,,,,,,,,,,,,,,,,,,,,,,,,,,,,,,,,,,,,,,,,,,,,,,
449.65,-5,136.5,WR0AEN,Denver,CO,OPEN,,S,58.81,S,,08,8212,39.73759842,-104.98500061,449.65,444.65,,,Denver,On-Air,,Colorado Amateur Repeater Network (CARN),,CCARC,2012-11-16,,,,,,,,yes,WR0AEN (B),jfindu lookup / dstar-users lookup,,,,,,,,,,,,,,,,,,,,,,,,,,,,,,,,,,,,,,,,,,,,,,,,,,,
449.675,-5,136.5,WR0AEN,Denver,CO,OPEN,I,S,58.81,S,,08,8213,39.73759842,-104.98500061,449.675,444.675,,,Denver,On-Air,,Colorado Amateur Repeater Network (CARN),,CCARC,2012-11-16,,,,,,,,yes,WR0AEN (B),jfindu lookup / dstar-users lookup,,,,,,,,,,,,,,,,,,,,,,,,,,,7708,,,,,,,,,,,,,,,,,,,,,,,,
448.625,-5,100,W0TX,"Golden, Centennial Cone",CO,OPEN,,,59.34,SSW,,08,112,39.75249863,-105.35800171,448.625,443.625,100,100,Jefferson,On-Air,Denver metro area.,Denver Radio Club,E-power.,CCARC,2017-03-11,,,,,,DRC: Sun at 20:30.,DRC Repeaters,,,,DM79HS,,,,,,,,,,,,,"Full-time to 145.49000 (W0TX) at Idaho Springs, Centennial Cone, CO .",,,,,,,,,,,,,,,,,,,,,,,,,,,,,,,,,,,,,
146.985,-0.6,100,K0FEZ,"Golden, Centennial Cone",CO,OPEN,I,,59.35,SSW,,08,82,39.75249863,-105.35900116,146.985,146.385,100,100,Denver,On-Air,,El Jebel RADOPS,E-power.,CCARC,2016-09-05,,,,,,RADOPS: Sun at 19:00.,,,,,,,,,,,,,,,,,,,,,,,,,,,,,,,3346,,,,,,,,,,,,,,,,,,,,,,,,
145.28,-0.6,100,KE0SJ,"Golden, Centennial Cone",CO,OPEN,,,59.35,SSW,,08,140,39.75249863,-105.35900116,145.28,144.68,100,,Jefferson,On-Air,Wide area.,,"Closed autopatch, e-power, linked.",CCARC,2015-05-22,,,,,,Sun at 19:30. Everyone welcome.,Intermountain Repeater Group,,,,DM79HS,"PL is usually off, allowing use by older transceivers.",,,,,,,,,,,,"Full-time to 449.52500 (KE0SJ) at Golden, Centennial Cone, CO .",,,,,,,,,,,,,,,,,,,,,,,,,,,,,,,,,,,,,
449.525,-5,CSQ,KE0SJ,"Golden, Centennial Cone",CO,OPEN,,,59.35,SSW,,08,138,39.75249863,-105.35900116,449.525,444.525,CSQ,,Jefferson,On-Air,,KE0SJ,E-power.,CCARC,2015-05-23,,,,,,,Intermountain Repeater Group,,,,DM79HS,,,,,,,,,,,,,"Full-time to 145.28000 (KE0SJ) at Golden, Centennial Cone, CO .",,,,,,,,,,,,,,,,,,,,,,,,,,,,,,,,,,,,,
146.64,-0.6,100,N0PUF,"Golden, Centennial Cone",CO,OPEN,,,59.35,SSW,,08,77,39.75249863,-105.35900116,146.64,146.04,100,,Jefferson,On-Air,Wide area. Repeater Coverage Map,Denver Radio League,E-power.,CCARC,2020-03-13,,,,,,,DRL Repeaters,,,,,8,,,,,,,,,,,,,,,,,,,,,,,,,,,,,,,,,,,,,,,,,,,,,,,,,
927.975,-25.9,67,W0SKY,"Golden, Lookout Mountain",CO,OPEN,A,,59.42,S,,08,18156,39.73329926,-105.23699951,927.975,902.0375,67,67,Jefferson,On-Air,"Denver, Golden",,,CCARC,2020-01-01,,,,,,,http://www.w0sky.com,,,,,,,,,,,,,,,,,,,,,,Standard AllStar,,,,,,,,,,,,,,,,40195,,,,,,,,,,,,,,,,
449.625,-5,141.3,KE0VH,"Golden, Lookout Mountain",CO,OPEN,,Y,59.46,S,,08,139,39.73300171,-105.23899841,449.625,444.625,141.3,141.3,Jefferson,On-Air,,,E-power,CCARC,2019-06-19,,,,,,,,,,,DM79JR,,,,,,,,,,,,,,,,,,,,yes,Open ↑ / Open ↓,Yes; analog capable.,,,,,,,,,,,,,,,,,,,,,,,,,,,,
145.37,-0.6,CC,N0SZ,"Golden, Lookout Mountain",CO,OPEN,,D,59.57,S,,08,10939,39.73070145,-105.23300171,145.37,144.77,,,Jefferson,On-Air,,Rocky Mountain Ham Radio,700,CCARC,2019-11-27,yes,7,RMHR c Record retrieved from radioid.net,,,,Rocky Mountain Ham Radio,,,,DM79JR,See the website for programming information. Voice ID is required for data/GPS/text on TG 705,,310808,,,,,,,,,,,,,,,,,,,,,,,,,,,,,,,,,,,,,,,,,,,,,,,
446.8375,-5,CC,WA2YZT,"Golden, Lookout",CO,OPEN,,D,59.58,S,,08,3753,39.73049927,-105.23200226,446.8375,441.8375,,,Jefferson,On-Air,,WA2YZT,200,CCARC,2019-11-27,yes,7,RMHR c Record retrieved from radioid.net,,,,,,,,DM79JR,See website for more info on CC/TS/TG programming. www.rmham.org,,310802,,,,,,,,,,Full-time to the Colorado TRBO System .,,,,,,,,,,,,,,,,,,,,,,,,,,,,,,,,,,,,,
145.25,-0.6,,W0CDS,"Golden, Lookout Mountain",CO,OPEN,,S,59.59,S,,08,3739,39.73049927,-105.23300171,145.25,144.65,,,Jefferson,On-Air,,Colorado D-Star,,CCARC,2014-01-03,,,,,,,Colorado D-Star,yes,W0CDS (C) Repeater,jfindu lookup / dstar-users lookup,DM79JR,,,,,,,,,,,,,,,,,,,,,,,,,,,,,,,,,,,,,,,,,,,,,,,,,,
446.9625,-5,,W0CDS,"Golden, Lookout Mountain",CO,OPEN,,S,59.59,S,,08,2769,39.73049927,-105.23300171,446.9625,441.9625,,,Jefferson,On-Air,,Colorado D-Star,,CCARC,2017-03-11,,,,,,,Colorado D-Star,yes,W0CDS (B) Repeater,jfindu lookup / dstar-users lookup,DM79JR,,,,,,,,,,,,,,,,,,,,,,,,,,,,,,,,,,,,,,,,,,,,,,,,,,
1283.9625,-20,,W0CDS,"Golden, Lookout Mountain",CO,OPEN,,S,59.59,S,,08,3751,39.73049927,-105.23300171,1283.9625,1263.9625,,,Jefferson,On-Air,,Colorado D-Star,,CCARC,2014-01-03,,,,,,,Colorado D-Star,yes,W0CDS (A) Repeater,jfindu lookup / dstar-users lookup,DM79JR,,,,,,,,,,,,,,,,,,,,,,,,,,,,,,,,,,,,,,,,,,,,,,,,,,
1299.9,0,,W0CDS,"Golden, Lookout Mountain",CO,OPEN,,S,59.59,S,,08,8222,39.73049927,-105.23300171,1299.9,1299.9,,,Jefferson,On-Air,,Colorado D-Star,,,2014-01-03,,,,,,,Colorado D-Star,yes,W0CDS (A) DVAP 24/7,jfindu lookup / dstar-users lookup,,,,,,,,,,,,,,,,,,,,,,,,,,,,,,,,,,,,,,,,,,,,,,,,,,,
447.825,-5,D073,W0TX,"Lakewood, St Anthony Medical Campus",CO,OPEN,,,60.1,S,,08,5805,39.71620178,-105.12999725,447.825,442.825,D073,,Jefferson,On-Air,,Denver Radio Club,,CCARC,2017-03-11,,,,,,,,,,,DM79KR,Now operating in Narrow Band mode with Digital Code Squelch. Please reset your programing to use: 12.5 KHz. bandwidth (+/- 2.5 KHz. deviation).,,,,,,,,,,,,,,,,,,,,,,,,,,,,,,,,,,,,,,,,,,,,,,,,,
147.285,0.6,88.5,KB0VJJ,"Winter Park, Winter Park",CO,OPEN,,,60.12,SW,,08,15582,39.88650131,-105.76300049,147.285,147.885,88.5,123,Grand,On-Air,,Colorado Connection,,CCARC,2017-01-06,,,,,,,,,,,,,,,,,,,,,,,,Full-time to the Colorado Connection System .,,,,,,,,,,,,,,,,,,,,,,,,,,,,,,,,,,,,,
448.4,-5,94.8,N0ZUQ,Aurora,CO,OPEN,,,60.62,SSE,,08,8202,39.72940063,-104.83200073,448.4,443.4,94.8,,Arapahoe,On-Air,,,,CCARC,2012-11-12,,,,,,,,,,,,,,,,,,,,,,,,,,,,,,,,,,,,,,,,,,,,,,,,,,,,,,,,,,,,,
448.275,-5,156.7,W0BG,Aurora,CO,OPEN,,,60.62,SSE,,08,8199,39.72940063,-104.83200073,448.275,443.275,156.7,,Arapahoe,On-Air,,W0BG,,CCARC,2013-01-05,,,,,,,,,,,,,,,,,,,,,,,,,,,,,,,,,,,,,,,,,,,,,,,,,,,,,,,,,,,,,
449.95,-5,77,W9SL,Aurora,CO,OPEN,,,60.62,SSE,,08,8743,39.72940063,-104.83200073,449.95,444.95,77,77,Arapahoe,On-Air,Primarily to the North along I-25 corridor,W9SL Owner,,CCARC,2019-08-23,,,,,,,,,,,,,,,,,,,,,,,,,,,,,,,,,,,,,,,,,,,,,,,,,,,,,,,,,,,,,
448.825,-5,,WN7ANT,Aurora,CO,OPEN,W,Y,60.62,SSE,,08,16032,39.72940063,-104.83200073,448.825,443.825,,,Arapahoe,On-Air,,,,,2017-12-13,,,,,,,,,,,,,,,,,,,,,,,,,,,,,,,yes,Open ↑ / Open ↓,,,,,,,,,,,,,,,,,,30584,,,,,,,,,,,
448.5,-5,100,KB0UDD,"Aurora, Smokey Hill",CO,OPEN,,,60.63,SSE,,08,92,39.72940063,-104.83100128,448.5,443.5,100,,Denver,On-Air,Greater Denver area.,Castle Rock Repeater Group,E-power.,CCARC,2017-03-11,,,,,,,,,,,,,,,,,,,,,,,,"Full-time to 145.40000 (KB0UDD) at Aurora, Smoky Hill, CO .",,,,,,,,,,,,,,,,,,,,,,,,,,,,,,,,,,,,,
448.75,-5,100,N0ELY,Lakewood,CO,OPEN,,,60.89,S,,08,8204,39.70460129,-105.1230011,448.75,443.75,100,100,Jefferson,Off-Air,Local.,,E-power.,CCARC,2019-08-23,,,,,N0ELY,,,,,,DM79KQ,,,,,,,,,,,,,,,,,,,,,,,,,,,,,,,,,,,,,,,,,,,,,,,,,,
53.09,-1.7,107.2,W0TX,"Lakewood, Green Mountain",CO,OPEN,,,61.32,S,,08,105,39.70080185,-105.1780014,53.09,51.39,107.2,,Jefferson,On-Air,Metro Denver area.,Denver Radio Club,E-power.,CCARC,2017-03-11,,,,,,,DRC Repeaters,,,,DM79JQ,,,,,,,,,,,,,,,,,,,,,,,,,,,,,,,,,,,,,,,,,,,,,,,,,,
147.33,0.6,100,W0TX,"Lakewood, Green Mountain",CO,OPEN,,,62.48,S,,08,85,39.68220139,-105.14299774,147.33,147.93,100,,Jefferson,On-Air,Metro Denver and the foothills.,Denver Radio Club,E-power.,CCARC,2017-03-31,,,,,,SATERN: Thu at 19:30.,DRC Repeaters,,,,,Not recommeded to use tone squelch on this repeater.,,,,,,,,,,,,,,,,,,,,,,,,,,,,,,,,,,,,,,,,,,,,,,,,,
224.38,-1.6,100,W0TX,"Lakewood, Green Mountain",CO,OPEN,,,62.48,S,,08,267,39.68220139,-105.14299774,224.38,222.78,100,100,Jefferson,On-Air,,Denver Radio Club,,CCARC,2017-03-11,,,,,,,DRC Repeaters,,,,,,,,,,,,,,,,,,,,,,,,,,,,,,,,,,,,,,,,,,,,,,,,,,,,,,
