Frequency,Offset,Tone,Call,Location,ST/PR,Use,VOIP,DGTL,Mi,Dir,,state_id,ID,Latitude,Longitude,Downlink,Uplink,Uplink Tone,Downlink Tone,YSF Digital Enabled,DG-ID,WIRES-X,County,Grid,Op Status,Coverage,Affiliate,Features,Mixed-Mode,Notes,Last update,Sponsor,Links,EchoLink,IRLP,Nets,Web links,Coordination,Bandwidth,AllStar,Feed,DMR Enabled,Color Code,DMR ID,IPSC Network,Wide Network,Talkgroups,Rocky Mountain Wide,Southern Colorado,On-air,Commands,Local/Cluster,Central Regional,Colorado,REACT,CO-Park County,D-STAR Enabled,Node,Sources,TAC 310,TAC 311,Colorado Chat,Eastern Colorado,P-25 Digital Enabled,NAC,Default Reflector,NXDN Enabled,RAN,NXDN Bandwidth,NXDN Network,Location Photo,Devilshead Local,Local Network,Northern Colorado Regional,Talkgroup Network,RX Location,Gunbarrel,Lousville,Lyons,Louisville #2,Worldwide,North America,English,DCI Bridge,Texas,COMM 1,Texas/Oklahoma Regional USA,N. Colorado,Mountain Reg USA,Worldwide English
147.36,0.6,,KC0ITF,"La Junta, North La Junta",CO,PRIVATE,W,Y,1.29,NE,,08,167,37.99950027,-103.52899933,147.36,147.96,,123,yes,Open ↑ / Open ↓,11360,Otero,DM87FX,On-Air,La Junta: U.S. Route 50 CO State Hwy 10 CO State Hwy 109 CO State Hwy 194 U.S. Route 350,KC0ITF,E-power,Yes; analog capable.,Digital Wires-X,2018-09-30,,,,,,,,,,,,,,,,,,,,,,,,,,,,,,,,,,,,,,,,,,,,,,,,,,,,,,,,,,,
449.5,-5,123,N0LAR,Lamar,CO,OPEN,EI,,50.78,ESE,ON - IDLE,08,171,38.08720016,-102.62000275,449.5,444.5,123,123,,,,Prowers,DM-88,On-Air,45,,Linked full time to 146.610 (N0LAR) repeater,,,2019-12-29,Lamar ARC,"Full-time to 146.61000 (N0LAR) at Lamar, CO .",37784,3774,NWS net: Daily 12:15pm,http://www.qrz.com/db/n0lar,CCARC,,,,,,,,,,,,,,,,,,,,,,,,,,,,,,,,,,,,,,,,,,,,,,,,,,,,
146.61,-0.6,123,N0LAR,Lamar,CO,OPEN,EI,,51.52,ESE,ON - IDLE,08,3794,38.03689957,-102.59999847,146.61,146.01,123,123,,,,Prowers,DM-88,On-Air,Hwy 287 - Springfield to Eads Hwy 50 - Holly to Rocky Ford. 45 mi radius.,,,,,2019-12-29,Lamar Amateur Radio Club,"Full-time to 449.50000 (N0LAR) at Lamar, CO .",37784,3774,NWS Net 12:15pm daily,http://www.qrz.com/db/n0lar,CCARC,25,,,,,,,,,,,,,,,,,,,,,,,,,,,,,,,,,,,,,,,,,,,,,,,,,,,
449.975,-5,100,K0JSC,"Pueblo, Cedarwood",CO,OPEN,EIA,,51.56,W,ON - IDLE,08,5369,38.0340004,-104.48899841,449.975,444.975,100,100,,,,Pueblo,DM78SA18,On-Air,I-25 from Walsenburg to Wyoming and US-50 from La junta to Monarch Pass Repeater Coverage Map,,2,,Can be linked to various local repeater systems via the remote base. Echolink/IRLP connects restricted. Email me to be added to the authorized list.,2017-03-11,K0JSC,"Linkable to 146.79000 (W0PHC) at Pueblo, Baculite Mesa, CO . Linkable to 146.88000 (W0PHC) at Pueblo, 12 Mile Hill, CO . Linkable to 145.49000 (WD0EKR) at Canon City, Fremont Peak, CO . Linkable to 145.13000 (KB0VJJ) at Colorado Springs, Cheyenne Mountain, CO . Linkable to 145.16000 (W0CRA) at Colorado Springs, Cheyenne Mountain, CO . Linkable to 145.46000 (WB0WDF) at Cripple Creek, CO . Full-time to the The Fun Machine System . 146.43000 simplex. 146.44500 simplex.",363976,7301,APRS Net: Sun at 19:00. Region 5 District 2 ARES Net: Sun at 19:30. Statewide ARES Net: Sun at 20:00. Region 5 District 1 ARES Net: Mon at 19:00. RGARC Net: Wed at 19:00.,K0JSC dot Com,CCARC,,28368,Listen Live,,,,,,,,,,,,,,,,,,,,,,,,,,,,,,,,,,,,,,,,,,,,,,,,,
146.73,-0.6,88.5,W0PHC,"Walsenburg, N Rattlesnake Butte",CO,OPEN,,,51.87,WSW,,08,247,37.77190018,-104.45600128,146.73,146.13,88.5,,,,,Huerfano,DM77SS,On-Air,"Wide area: Pueblo, Huerfano, Otero, and Las Animas Counties.",,6,,,2019-12-10,Pueblo Amateur Radio Club,,,,,Pueblo Ham Club,CCARC,,,,,,,,,,,,,,,,,,,,,,,,,,,,,,,,,,,,,,,,,,,,,,,,,,,,
449.2,-5,CC 162.2,W0CTS,Lamar,CO,OPEN,,D,55.94,ESE,Static Talkgroups: 3108 - Colorado - Slot 1 3740 - REACT - Slot 1,08,18386,38.12810135,-102.53199768,449.2,444.2,162.2,162.2,,,,Prowers,,On-Air,,,TS1 TG3108 Colorado TS1 TG31083 Co Severe Wx TS2 not networked/local,,,2019-12-21,,,,,,https://brandmeister.network/?page=repeater&amp;id=311409,,,,,yes,1,311409,BrandMeister c Record retrieved from radioid.net,,,,,,,,,,,,,,,,,,,,,,,,,,,,,,,,,,,,,,,,,,,,,
146.64,-0.6,100,KZ0DEM,"Pritchett, Tator Butte",CO,OPEN,,,56.65,SE,,08,3792,37.36999893,-102.85900116,146.64,146.04,100,100,,,,Las Animas,,Off-Air,Wide area: West BACA and East Las Animas counties.,,,,,2015-12-12,,,,,,KZ0DEM Repeaters,CCARC,,,,,,,,,,,,,,,,,,,,,,,,,,,,,,,,,,,,,,,,,,,,,,,,,,,,
446.9875,-5,CC,K0JSC,Pueblo,CO,OPEN,,D,60.44,WNW,,08,10785,38.23070145,-104.61100006,446.9875,441.9875,,,,,,Pueblo,DM78QF,Off-Air,,RMHAM,,,,2019-11-27,,Full-time to the Colorado TRBO System .,,,,Rocky Mountain Ham Radio,CCARC,,,,yes,6,310821,RMHR c Record retrieved from radioid.net,,"Open Talkgroup View Assignment TS TG Access Rocky Mountain Wide 1 700 Southern Colorado 2 719 function myFunction(id) { var x = document.getElementById(id); if (x.className.indexOf(""w3-show"") == -1) { x.className += "" w3-show""; } else { x.className = x.className.replace("" w3-show"", """"); } }",1,2,,,,,,,,,,,,,,,,,,,,,,,,,,,,,,,,,,,,,,,,,
447.275,-5,100,K0JSC,"Pueblo, Metro",CO,OPEN,,,60.44,WNW,,08,9527,38.23049927,-104.61100006,447.275,442.275,100,100,,,,Pueblo,DM78QF,On-Air,,The Fun Machine,,,"Moved to Pueblo. Now called ""Pueblo Metro""",2017-01-06,,Full-time to the The Fun Machine System .,,,APRS Net: Sun at 19:00. Region 5 District 2 ARES Net: Sun at 19:30. Statewide ARES Net: Sun at 20:00. Region 5 District 1 ARES Net: Mon at 19:00. EOSS Net: Tue at 20:00. RGARC Net: Wed at 19:00.,The Fun Machine,CCARC,,,Listen Live,,,,,,,,,,,,,,,,,,,,,,,,,,,,,,,,,,,,,,,,,,,,,,,,,
147.24,0.6,103.5,KJ0T,Pueblo,CO,OPEN,,,60.44,WNW,,08,3747,38.23059845,-104.61100006,147.24,147.84,103.5,,,,,Pueblo,DM78QF,Off-Air,Pueblo and Fremont Counties,,,,,2012-06-13,TARA,,,,,,CCARC,,,,,,,,,,,,,,,,,,,,,,,,,,,,,,,,,,,,,,,,,,,,,,,,,,,,
449.9,-5,107.2,N1FSX,Punkin Center,CO,OPEN,,,60.5,N,,08,7395,38.85200119,-103.69999695,449.9,444.9,107.2,,,,,Lincoln,DM88DU,On-Air,,BSAR,,,,2012-07-20,,,,,,,CCARC,,,,,,,,,,,,,,,,,,,,,,,,,,,,,,,,,,,,,,,,,,,,,,,,,,,,
146.655,-0.6,123,K0ST,"Pueblo, Pueblo",CO,OPEN,,,60.81,WNW,,08,192,38.25439835,-104.60900116,146.655,146.055,123,,,,,Pueblo,,On-Air,,,,,,2013-05-07,K0ST,,,,,,CCARC,,,,,,,,,,,,,,,,,,,,,,,,,,,,,,,,,,,,,,,,,,,,,,,,,,,,
447.7,-5,CC 210.7,KF0KR,"Pueblo, Pueblo",CO,PRIVATE,IA,D,60.81,WNW,,08,8530,38.25439835,-104.60900116,447.7,442.7,210.7,210.7,,,,Pueblo,,Off-Air,,,,Yes; analog capable.,,2019-11-27,,,,7389,,,CCARC,,29228,,yes,1,310805,KFKR- c Record retrieved from radioid.net,,,,,,,,,,,,,,,,,,,,,,,,,,,,,,,,,,,,,,,,,,,,,
449.725,-5,100,N0PWZ,Palmer Divide,CO,OPEN,I,,60.81,WNW,,08,189,38.25439835,-104.60900116,449.725,444.725,100,,,,,El Paso,,On-Air,,,,,,2012-11-10,N0PWZ,,,3043,,,CCARC,,,,,,,,,,,,,,,,,,,,,,,,,,,,,,,,,,,,,,,,,,,,,,,,,,,,
146.79,-0.6,88.5,W0PHC,"Pueblo, Baculite Mesa",CO,OPEN,,,61.04,WNW,,08,193,38.36240005,-104.55999756,146.79,146.19,88.5,,,,,Pueblo,DM78ri,On-Air,Wide area.,,E-power.,,,2019-12-10,Pueblo Amateur Radio Club,,,,,Pueblo Amateur Radio Club,CCARC,,,,,,,,,,,,,,,,,,,,,,,,,,,,,,,,,,,,,,,,,,,,,,,,,,,,
447.95,-5,CC 88.5,W0PHC,Pueblo,CO,OPEN,,D,61.04,WNW,,08,198,38.36240005,-104.55999756,447.95,442.95,88.5,,,,,Pueblo,DM78ri,On-Air,Wide area.,,E-power.,Yes; analog capable.,Dual Mode Analog/DMR,2019-12-10,Pueblo Amateur Radio Club,,,,,Pueblo Amateur Radio Club,CCARC,,,,yes,0,,c Record retrieved from radioid.net,,,,,,,,,,,,,,,,,,,,,,,,,,,,,,,,,,,,,,,,,,,,,
224.26,-1.6,88.5,ND0Q,"Pueblo, Baculite Mesa",CO,OPEN,,,61.71,WNW,,08,195,38.39250183,-104.55500031,224.26,222.66,88.5,,,,,Pueblo,,Off-Air,Wide area.,,E-power.,,,2013-05-07,Pueblo Ham Club,,,,,PHC repeaters,CCARC,,,,,,,,,,,,,,,,,,,,,,,,,,,,,,,,,,,,,,,,,,,,,,,,,,,,
147,0.6,,NE0Z,"Pueblo, CSU",CO,PRIVATE,,,62.56,WNW,,08,8173,38.30690002,-104.62000275,147,147.6,,,,,,Pueblo,DM78QH,On-Air,,,,,,2014-02-26,Carl Higbee,,,,,,CCARC,,,,,,,,,,,,,,,,,,,,,,,,,,,,,,,,,,,,,,,,,,,,,,,,,,,,
145.115,-0.6,88.5,W0PHC,Pueblo,CO,OPEN,,,63.52,WNW,,08,191,38.2521019,-104.66200256,145.115,144.515,88.5,,,,,Pueblo,DM78qg,On-Air,,,E-power.,Yes; analog capable.,,2019-12-10,Pueblo Amateur Radio Club,,,,,http://www.puebloradio.org/,CCARC,6.25,,,,,,,,,,,,,,,,,,,,,,,,,,,,,,,,,,,,,,,,,,,,,,,,,,,
147.09,0.6,118.8,KZ0DEM,Springfield,CO,OPEN,,,64.6,SE,,08,8174,37.4083,-102.614,147.09,147.69,118.8,118.8,,,,Baca,,,,,,,,2012-11-12,BCDEARC,,,,,,CCARC,,,,,,,,,,,,Unknown,,,,,,,,,,,,,,,,,,,,,,,,,,,,,,,,,,,,,,,,
147.33,0.6,118.8,KZ0DEM,Springfield,CO,OPEN,EI,,64.6,SE,Node Offline,08,6093,37.40829849,-102.61399841,147.33,147.93,118.8,118.8,,,,Baca,,Off-Air,,,,,,2018-03-12,Baca County Amateur Emergency Management,,97142,7142,,KZ0DEM Repeaters,CCARC,,,,,,,,,,,,,,,,,,,,,,,,,,,,,,,,,,,,,,,,,,,,,,,,,,,,
449.2,-5,118.8,KZ0DEM,Springfield,CO,OPEN,EI,,64.6,SE,Node Offline,08,4588,37.4083,-102.614,449.2,444.2,118.8,118.8,,,,Baca,,On-Air,provides coverage to central Baca County,,,,,2011-08-21,Baca County Div of Emerg Mgt Communications,,97142,7142,,,,,,,,,,,,,,,,55,,,,,,,,,,,,,,,,,,,,,,,,,,,,,,,,,,,,,,,
146.88,-0.6,CC 88.5,W0PHC,"Pueblo, 12 Mile Hill",CO,OPEN,,D,65.08,WNW,,08,194,38.20700073,-104.70700073,146.88,146.28,88.5,,,,,Pueblo,DM78pe,On-Air,Wide area.,,E-power.,Yes; analog capable.,,2019-12-10,Pueblo Amateur Radio Club,,,,,http://www.puebloradio.org/,CCARC,,,,yes,0,,c Record retrieved from radioid.net,,,,,,,,,,,,,,,,,,,,,,,,,,,,,,,,,,,,,,,,,,,,,
448.975,-5,100,K0JSC,Pueblo West,CO,OPEN,EIA,,68.3,WNW,ON - IDLE,08,7994,38.3030014,-104.73400116,448.975,443.975,100,100,,,,Pueblo,,On-Air,,,,,Off air. Will return to service,2017-03-11,,Full-time to the The Fun Machine System .,363976,7301,,http://www.k0jsc.com,CCARC,,28368,Listen Live,,,,,,,,,,,,,,,,,,,,,,,,,,,,,,,,,,,,,,,,,,,,,,,,,
446.7625,-5,CC,KZ0DEM,Vilas,CO,OPEN,,D,73.33,SE,,08,17522,37.37469864,-102.4469986,446.7625,441.7625,,,,,,Baca,,,Baca County,,,,TS1​ 310815 - Fun Machine Link - Static,2019-11-27,Southeast Colorado REACT,,,,,http://www.secahr.com/southeast-colorado-react.html,,,,,yes,7,310841,RMHAM c Record retrieved from radioid.net,,"Open Talkgroup View Assignment TS TG Access Local/Cluster 2 2 Full-Time Central Regional 2 720 Full-Time Colorado 2 3108 Full-Time REACT 2 3740 Full-Time CO-Park County 2 31081 Full-Time function myFunction(id) { var x = document.getElementById(id); if (x.className.indexOf(""w3-show"") == -1) { x.className += "" w3-show""; } else { x.className = x.className.replace("" w3-show"", """"); } }",,,Unknown,,2,2,2,2,2,,,,,,,,,,,,,,,,,,,,,,,,,,,,,,,,,,
447,-5,103.5,KC0VJD,Hugo,CO,OPEN,W,Y,73.96,N,,08,17059,39.05419922,-103.48000336,447,442,,,yes,Open ↑ / Open ↓,30534,Lincoln,,On-Air,"I-70, US-71, US-287, US-40, US-24, Hugo, Limon, Genoa, Punkin Center, Arriba.",,APRS repeater &amp; I-Gate / Weather station,,,2020-01-26,Delbert Noakes (KC0VJD),,,,,,CCARC,,,,,,,,,,,,,,,,,,,,,,,,,,,,,,,,,,,,,,,,,,,,,,,,,,,,
449.6,-5,107.2,KC0CVU,"Trinidad, Raton Pass",CO,OPEN,,,76.92,SW,,08,240,37.16939926,-104.5,449.6,444.6,107.2,,,,,Las Animas,,Off-Air,Wide area.,,E-power.,,,2017-10-24,Cheyenne Mtn Rptr Grp,,,,,CMRG Repeaters,CCARC,,,,,,,,,,,,,,,,,,,,,,,,,,,,,,,,,,,,,,,,,,,,,,,,,,,,
147.375,0.6,100,K0BV,"Trinidad, Raton Pass",CO,OPEN,,,76.95,SW,,08,8180,37.16949844,-104.50099945,147.375,147.975,100,100,,,,Las Animas,,Off-Air,Good coverage along I-25 between CO/NM state line and 40 miles north.,,,,,2017-10-24,K0BV,,,,,,CCARC,,,,,,,,,,,,,,,,,,,,,,,,,,,,,,,,,,,,,,,,,,,,,,,,,,,,
447.375,-5,100,KG5JL,"Trinidad, Raton Pass",CO,OPEN,,Y,76.95,SW,,08,13499,37.16949844,-104.50099945,447.375,442.375,100,,yes,Open ↑ / Open ↓,,Las Animas,,On-Air,"Covers I-25 from CO/NM border to north of Trinidad, CO.",,E-power (batt).,Yes; analog capable.,,2018-04-04,KG5JL,,,,,,CCARC,,,,,,,,,,,,,,,,,,,,,,,,,,,,,,,,,,,,,,,,,,,,,,,,,,,,
447.6,-5,103.5,KC0VJD,Firstview,CO,OPEN,W,Y,77.77,NE,,08,17703,38.79579926,-102.54799652,447.6,442.6,,,yes,Open ↑ / Open ↓,35710,Cheyenne,DM88RT,On-Air,"US-40, US-287, US-385, CO-94, CO-96 Kit Carson, Cheyenne Wells, Firstview, Eads, Aroya, Sheridan Lake",,"APRS Digireater &amp; iGate, Weather Station",,,2019-04-24,Delbert Noakes (KC0VJD),,,,,,CCARC,,,,,,,,,,,,,,,,,,,,,,,,,,,,,,,,,,,,,,,,,,,,,,,,,,,,
147.39,0.6,88.5,WB5NJU,Kenton,NM,OPEN,,,80.57,SSE,,35,18214,36.90100098,-103.00299835,147.39,147.99,88.5,,,,,Union,,On-Air,,,,,Repeater on the New Mexico - Oklahoma border,2019-10-30,,,,,,,,,,,,,,,,,,,,,,,,,,,,,,,,,,,,,,,,,,,,,,,,,,,,,,,,,,,
446.775,-5,,KD0RDI,"Trinidad, Raton Pass",CO,OPEN,,S,80.79,SW,,08,8086,37.14569855,-104.57099915,446.775,441.775,,,,,,Las Animas,,On-Air,,,,,,2017-12-13,Cheyenne Mountain Repeater Group (CMRG),,,,,,CCARC,,,,,,,,,,,,,,,,,,,yes,KD0RDI (B),jfindu lookup / dstar-users lookup,,,,,,,,,,,,,,,,,,,,,,,,,,,,,,,
447.6,-5,CC 88.5,W0PHC,"Walsenburg, Badito Cone",CO,OPEN,,D,81.94,W,,08,18345,37.77199936,-105.02200317,447.6,442.6,88.5,88.5,,,,Huerfano,DM77LS,Off-Air,,,,Yes; analog capable.,Repeater off line due to road closure for the winter. (note entered 12/2019),2019-12-12,Pueblo Amateur Radio Club,,,,,http://www.puebloradio.org/,CCARC,6.25,,,yes,,,c Record retrieved from radioid.net,,,,,,,,,,,,,,,,,,,,,,,,,,,,,,,,,,,,,,,,,,,,,
145.43,-0.6,107.2,WA6IFI,"Trinidad, Raton Pass",CO,OPEN,,,84.96,SW,,08,239,36.99739838,-104.46700287,145.43,144.83,107.2,,,,,Las Animas,,On-Air,,,,,,2017-10-24,Cheyenne Mountain Repeater Group,,,,,CMRG Repeaters,CCARC,,,,,,,,,,,,,,,,,,,,,,,,,,,,,,,,,,,,,,,,,,,,,,,,,,,,
446.775,-5,,KD0RDI,"Raton, Raton Pass",NM,OPEN,,S,85.46,SW,,35,6805,36.99250031,-104.47399902,446.775,441.775,,,,,,Colfax,DM76SX,On-Air,,,,,,2017-07-22,Cheyenne Mountain Repeater Group,,,,,http://www.cmrg.org/,NMFCC,,,,,,,,,,,,,,,,,,,yes,KD0RDI (B) Repeater,jfindu lookup / dstar-users lookup,,,,,,,,,,,,,,,,,,,,,,,,,,,,,,,
146.85,-0.6,100,N5BOP,Des Moines,NM,OPEN,,,86.05,S,,35,73,36.76110077,-103.83399963,146.85,146.25,100,,,,,Union,,Off-Air,Wide area.,,E-power.,,,2015-08-13,Sierra Grande RC,,,,,,NMFCC,,,,,,,,,,,,,,,,,,,,,,,,,,,,,,,,,,,,,,,,,,,,,,,,,,,,
444.8,5,77,N5BOP,Des Moines,NM,OPEN,,,86.05,S,,35,74,36.76110077,-103.83399963,444.8,449.8,77,,,,,Union,,Off-Air,Wide area.,,E-power.,,,2015-08-13,Sierra Grande Repeater Club,,,,,,NMFCC,,,,,,,,,,,,,,,,,,,,,,,,,,,,,,,,,,,,,,,,,,,,,,,,,,,,
147.175,0.6,141.3,NM5EM,"Des Moines, Sierra Grande",NM,OPEN,,,86.05,S,,35,15638,36.76110077,-103.83399963,147.175,147.775,141.3,,,,,Union,,On-Air,,,,,,2017-01-22,NMEMA ARC,,,,,,NMFCC,,,,,,,,,,,,,,,,,,,,,,,,,,,,,,,,,,,,,,,,,,,,,,,,,,,,
145.355,-0.6,100,N0JPX,La Veta,CO,OPEN,I,,86.54,WSW,,08,168,37.50500107,-105.00700378,145.355,144.755,100,,,,,Huerfano,,On-Air,,,"E-power, linked.",,,2019-03-17,N0JPX,,,3974,,,CCARC,,,,,,,,,,,,,,,,,,,,,,,,,,,,,,,,,,,,,,,,,,,,,,,,,,,,
447.2,-5,151.4,,Falcon,CO,OPEN,,Y,87.24,NW,,08,13790,38.93299866,-104.60900116,447.2,442.2,,,yes,Open ↑ / Open ↓,,El Paso,,Testing,"Falcon, Black Forest, Peyton Areas",Garden of the Gods Amateur Radio Club,,,,2015-11-11,GGARC,,,,,,,,,,,,,,,,,,,,,,,,,,,,,,,,,,,,,,,,,,,,,,,,,,,,,,,,,,
146.85,-0.6,156.7,AD0TP,Colorado Springs,CO,OPEN,,,87.79,NW,,08,42,38.83969879,-104.7437973,146.85,146.25,156.7,103.5,,,,El Paso,DM78PU,On-Air,Greater Colorado Springs Area,Village 7 Amateur Radio Club,,,Please email with comments/signal reports,2020-02-10,AD0TP,,,,,http://www.v7arc.com/,CCARC,,,,,,,,,,,,,,,,,,,,,,,,,,,,,,,,,,,,,,,,,,,,,,,,,,,,
145.265,-0.6,100,KB0SRJ,"Colorado Springs, ~2 mi ENE USAFA North Gate",CO,OPEN,,Y,88.55,NW,,08,39,38.70000076,-104.90000153,145.265,144.665,,,yes,Open ↑ / Open ↓,,El Paso,DM78NQ,On-Air,Local. Good coverage of I25 corridor from Baptist Rd south to Fort Carson.,,,,,2019-03-07,Pikes Peak FM Association (http://PPFMA.ORG),,,,,PPFMA Repeaters,CCARC,,,,,,,,,,,,,,,,,,,,,,,,,,,,,,,,,,,,,,,,,,,,,,,,,,,,
145.385,-0.6,,KC0CVU,"Colorado Springs, Cheyenne Mountain",CO,OPEN,,S,88.62,NW,,08,8088,38.74449921,-104.86199951,145.385,144.785,,,,,,El Paso,DM78NR,Testing,Wide area,,,,"This repeater is operational and linked to XRF720. Currently, INBOUND traffic is making it in but OUTBOUND traffic is not getting to the gateway or reflector. We hope to have this resolved soon.",2019-12-29,Cheyenne Mountain Repeater Group (CMRG),,,,,http://www.cmrg.org,CCARC,,,,,,,,,,,,,,,,,,,yes,KC0CVU (C) Repeater,jfindu lookup / dstar-users lookup,,,,,,,,,,,,,,,,,,,,,,,,,,,,,,,
145.13,-0.6,88.5,KB0VJJ,"Colorado Springs, Cheyenne Mountain",CO,OPEN,,,88.64,NW,,08,37,38.74520111,-104.86199951,145.13,144.53,88.5,123,,,,El Paso,,On-Air,Wide area: South toward Pueblo and north to Monument. Decent coverage to the east. Little coverage to the west.,,9,,Linked into the Colorado Connection System,2019-11-11,Colorado Connection,Full-time to the Colorado Connection System .,,,Colorado Traffic Net: Daily at 19:00. Colorado Connection Net (all welcome): Thu at 20:00. Statewide ARES: Sun at 20:00. Colorado Preparedness Net: Sat at 09:30,,CCARC,,,Listen Live,,,,,,,,,,,,,,,,,,,,,,,,,,,,,,,,,,,,,,,,,,,,,,,,,
446.9125,-5,,KC0CVU,"Colorado Springs, Cheyenne Mountain",CO,OPEN,,S,88.64,NW,,08,8087,38.74509811,-104.86199951,446.9125,441.9125,,,,,,El Paso,,Off-Air,,,,,This DStar repeater is up but not truly functional. It serves as a local repeater presently as it is not connected to the internet for now.,2019-12-28,Cheyenne Mountain Repeater Group (CMRG),,,,,,,,,,,,,,,,,,,,,,,,,yes,KC0CVU (B) Repeater,jfindu lookup / dstar-users lookup,,,,,,,,,,,,,,,,,,,,,,,,,,,,,,,
927.85,-25,D114,KC0CVU,"Colorado Springs, Cheyenne Mountain",CO,OPEN,,,88.64,NW,,08,7171,38.74499893,-104.86199951,927.85,902.85,D114,,,,,Teller,DM78NR,On-Air,,,9,,,2017-03-09,CMRG,"Full-time to 147.34500 (KC0CVU) at Colorado Springs, Cheyenne Mountain, CO . Full-time to 448.10000 (KC0CVU) at Colorado Springs, Cheyenne Mountain, CO .",,,,http://www.cmrg.org,CCARC,,,,,,,,,,,,,,,,,,,,,,,,,,,,,,,,,,,,,,,,,,,,,,,,,,,,
445.0625,-5,CC,N0SZ,"Colorado Springs, Cheyenne Mountain",CO,OPEN,,D,88.64,NW,"Welcome to The RMHAM DMR Machine, located on Cheyenne Mountain above Colorado Springs This machine sits atop Cheyenne Mountain overlooking Colorado Springs and Pueblo. The talkgroups that are setup on this system are the Fun Machine Analog transcoded and statically linked on TS1 as TG310815. At this time TS2 will carry TG3108 and 3740 statically and the following are all PTTable with a 15 minute activity timeout (310,31079,31080,31082,31083,31084,31085,31086,31088,310895,311,312,31200,31203,313,31327,314,3140,31400,31408,3148,315,31563,316,31600,31601,31602,31603,31604,31605,31606,31607,31608,31609,31623,31648,31652,317,318,319,3740,91,9112,93). No other TGs are PTTable from this system unless they are enabled. If you have a specific TG that would would like added to TS2 as a PTT TG please let me know and I will consider adding it.",08,12355,38.74509811,-104.86199951,445.0625,440.0625,,,,,,El Paso,,On-Air,,N0SZ Colorado Springs Brandmeister,Rocky Mountain Ham Radio Brandmeister Sites,,"This machine sits atop Cheyenne Mountain overlooking Colorado Springs and Pueblo. The talkgroups that are setup on this system are the Fun Machine Analog transcoded and statically linked on TS1 as TG310815. At this time TS2 will carry TG3108 statically and the following are all PTTable with a 15 minute activity timeout (310,31079,31080,31082,31083,31084,31085,31086,31088,311,312,31200,31203,313,31327,314,3140,31400,31408, 3148,315,31563,316,31600,31601,31602,31603,31604,31605,31606,31607,31608,31609,31623,31648,31652,317,318,319,3740,91,9112,93). No other TGs are PTTable from this system unless they are enabled. If you have a specific TG that would would like added to TS2 as a PTT TG please let me know and I will consider adding it.",2019-11-27,Rocky Mountain Ham Radio,,,,,,CCARC,,,,yes,1,310857,RMHAM c Record retrieved from radioid.net,,"Open Talkgroup View Assignment TS TG Access TAC 310 2 310 PTT TAC 311 2 311 PTT Colorado 2 3108 Full-Time Colorado Chat 2 31080 PTT function myFunction(id) { var x = document.getElementById(id); if (x.className.indexOf(""w3-show"") == -1) { x.className += "" w3-show""; } else { x.className = x.className.replace("" w3-show"", """"); } }",,,,,,,2,,,,,,2,2,2,,,,,,,,,,,,,,,,,,,,,,,,,,,,
53.13,-1.7,107.2,WA6IFI,"Colorado Springs, Cheyenne Mountain",CO,OPEN,,,88.64,NW,,08,8158,38.74499893,-104.86199951,53.13,51.43,107.2,107.2,,,,El Paso,DM78NR,On-Air,,,,,,2017-03-09,Cheyenne Mountain Repeater Group (CMRG),,,,,http://www.cmrg.org,CCARC,,,,,,,,,,,,,,,,,,,,,,,,,,,,,,,,,,,,,,,,,,,,,,,,,,,,
147.06,0.6,103.5,KE0AE,Genoa,CO,OPEN,A,,88.76,N,,08,128,39.26879883,-103.48799896,147.06,147.66,103.5,,,,,Lincoln,DM89GG,On-Air,"I-70, US-71, US-287, US-40, US-24",,"APRS repeater / weather station, remote base, e-power (solar - completely off the electrical grid).",,,2019-07-21,BSARC,,,,Big Sandy Net: Tues 19:00,http://www.bigsandyradio.com/,CCARC,,42740,,,,,,,,,,,,,,,,,,,,,,,,,,,,,,,,,,,,,,,,,,,,,,,,,,
147.345,0.6,107.2,KC0CVU,"Colorado Springs, Cheyenne Mountain",CO,OPEN,I,,89.11,NW,,08,47,38.73720169,-104.87999725,147.345,147.945,107.2,107.2,,,,El Paso,DM78NR,On-Air,Wide area.,,"Closed autopatch, e-power.",,,2018-01-15,,"Full-time to 927.85000 (KC0CVU) at Colorado Springs, Cheyenne Mountain, CO . Full-time to the Cheyenne Mtn Repeater Group System .",,3854,,http://www.cmrg.org/,CCARC,,,,,,,,,,,,,,,,,,,,,,,,,,,,,,,,,,,,,,,,,,,,,,,,,,,,
145.16,-0.6,107.2,W0CRA,"Colorado Springs, Cheyenne Mountain",CO,OPEN,EI,,89.11,NW,ON - IDLE,08,38,38.73720169,-104.87999725,145.16,144.56,107.2,107.2,,,,El Paso,,On-Air,"Wide area: Colorado Springs, Pueblo, and other areas of southeast and south central Colorado.",CRA VHF Link System,"Closed autopatch, e-power.",,Switch to this repeater at mile marker 170 on I-25.,2017-11-13,Colorado Repeater Association,"Full-time to 145.46000 (W0CRA) at Boulder, Eldorado Mountain, CO . Full-time to 147.22500 (W0CRA) at Larkspur, Westcreek, CO .",347086,3990,,http://www.w0cra.org/info/cosprgs.html#145160,CCARC,,,,,,,,,,,,,,,,,,,,,,,,,,,,,,,,,,,,,,,,,,,,,,,,,,,,
146.76,-0.6,107.2,KC0CVU,"Colorado Springs, Cheyenne Mountain",CO,OPEN,,,89.15,NW,,08,41,38.73720169,-104.8809967,146.76,146.16,107.2,107.2,,,,El Paso,DM78NR,On-Air,,,"Closed autopatch, e-power.",,,2018-01-15,Cheyenne Mountain Repeater Group,,,,,,CCARC,,,,,,,,,,,,,,,,,,,,,,,,,,,,,,,,,,,,,,,,,,,,,,,,,,,,
448,-5,107.2,KC0CVU,"Colorado Springs, Cheyenne Mountain",CO,OPEN,,,89.15,NW,,08,269,38.73720169,-104.8809967,448,443,107.2,,,,,El Paso,DM78NR,On-Air,,,,,,2018-01-15,,,,,,CMRG Repeaters,CCARC,,,,,,,,,,,,,,,,,,,,,,,,,,,,,,,,,,,,,,,,,,,,,,,,,,,,
448.1,-5,107.2,KC0CVU,"Colorado Springs, Cheyenne Mountain",CO,OPEN,,,89.15,NW,,08,53,38.73720169,-104.8809967,448.1,443.1,107.2,107.2,,,,El Paso,DM78NR,On-Air,Wide area.,,"Closed autopatch, e-power.",,,2018-01-15,,"Full-time to 927.85000 (KC0CVU) at Colorado Springs, Cheyenne Mountain, CO .",,,,CMRG Repeaters,CCARC,,,,,,,,,,,,,,,,,,,,,,,,,,,,,,,,,,,,,,,,,,,,,,,,,,,,
446.7375,-5,CC,K0RTS,"Genoa, Limon",CO,OPEN,,D,89.4,N,,08,13581,39.27830124,-103.5,446.7375,441.7375,,,,,,Lincoln,,On-Air,"I-70 H-40 H-287 Arriba, Genoa, Hugo, Limon 50 mile radius",RMHam,,,Colorado on TG700 Slot 1 Denver on TG720 Slot 2,2019-11-27,K0RTS KC0VJD,,,,,,CCARC,,,,yes,8,310829,RMHAM c Record retrieved from radioid.net,,"Open Talkgroup View Assignment TS TG Access Rocky Mountain Wide 1 700 Central Regional 2 720 function myFunction(id) { var x = document.getElementById(id); if (x.className.indexOf(""w3-show"") == -1) { x.className += "" w3-show""; } else { x.className = x.className.replace("" w3-show"", """"); } }",1,,,,,2,,,,,,,,,,,,,,,,,,,,,,,,,,,,,,,,,,,,,
224.32,-1.6,88.5,ND0Q,"Walsenburg, Deer Peak",CO,OPEN,,,89.42,W,,08,245,38.04109955,-105.18499756,224.32,222.72,88.5,,,,,Custer,DM78JA,Off-Air,,,11,,,2016-07-14,Pueblo Ham Club,,,,,PHC repeaters,CCARC,,,,,,,,,,,,,,,,,,,,,,,,,,,,,,,,,,,,,,,,,,,,,,,,,,,,
447.175,-5,88.5,W0PHC,Pueblo,CO,OPEN,,,89.42,W,,08,197,38.04109955,-105.18499756,447.175,442.175,88.5,,,,,Pueblo,DM78JA,Off-Air,Wide area: Southeast Colorado.,,11,,,2019-12-10,Pueblo Amateur Radio Club,,,,,http://www.puebloradio.org/,CCARC,,,,,,,,,,,,,,,,,,,,,,,,,,,,,,,,,,,,,,,,,,,,,,,,,,,,
147.28,0.6,100,NM5ML,"Raton, Sierra Grande",NM,OPEN,,,89.43,SSW,,35,136,36.90330124,-104.43900299,147.28,147.88,100,,,,,Colfax,,On-Air,Wide area.,,8,,,2018-01-07,,Full-time to the Mega-Link System .,,,,,NMFCC,,,,,,,,,,,,,,,,,,,,,,,,,,,,,,,,,,,,,,,,,,,,,,,,,,,,
448.725,-5,123,KA0TTF,"Colorado Springs, Fillmore Hill",CO,OPEN,,,89.56,NW,,08,56,38.77999878,-104.84999847,448.725,443.725,123,,,,,El Paso,,On-Air,,,,,,2016-04-19,KA0TTF,,,,,,CCARC,,,,,,,,,,,,,,,,,,,,,,,,,,,,,,,,,,,,,,,,,,,,,,,,,,,,
147.135,0.6,100,AA0L,Colorado Springs,CO,OPEN,,,90.07,NW,,08,8176,38.83969879,-104.80000305,147.135,147.735,100,,,,,El Paso,DM78OU,On-Air,,,6,,,2016-04-08,AA0L,,,,,,CCARC,,,,,,,,,,,,,,,,,,,,,,,,,,,,,,,,,,,,,,,,,,,,,,,,,,,,
449.575,-5,,,Colorado Springs,CO,CLOSED,,,90.67,NW,,08,8211,38.83390045,-104.82099915,449.575,444.575,,,,,,El Paso,,On-Air,,,,,,2016-08-10,RMHARC,,,,,,CCARC,,,,,,,,,,,,,,,,,,,,,,,,,,,,,,,,,,,,,,,,,,,,,,,,,,,,
448.3,-5,100,AA0L,Colorado Springs,CO,OPEN,,,90.67,NW,,08,8200,38.83390045,-104.82099915,448.3,443.3,100,,,,,El Paso,,On-Air,,,,,,2016-08-10,AA0L,,,,,,CCARC,,,,,,,,,,,,,,,,,,,,,,,,,,,,,,,,,,,,,,,,,,,,,,,,,,,,
447.35,-5,151.4,K0IRP,Colorado Springs,CO,OPEN,,,90.67,NW,,08,50,38.83390045,-104.82099915,447.35,442.35,151.4,,,,,El Paso,,On-Air,,,E-power.,,,2015-03-04,GGARC,,,,,,CCARC,,,,,,,,,,,,,,,,,,,,,,,,,,,,,,,,,,,,,,,,,,,,,,,,,,,,
224.06,-1.6,,KB0SRJ,Colorado Springs,CO,CLOSED,,,90.67,NW,,08,8182,38.83390045,-104.82099915,224.06,222.46,,,,,,El Paso,,,Wide area.,,"E-power, linked.",,,2012-11-12,Pikes Peak FM Association (PPFMA),,,,,,CCARC,,,,,,,,,,,,Unknown,,,,,,,,,,,,,,,,,,,,,,,,,,,,,,,,,,,,,,,,
447.025,-5,123,KF0WF,Colorado Springs,CO,OPEN,,,90.67,NW,,08,49,38.83390045,-104.82099915,447.025,442.025,123,,,,,El Paso,,Off-Air,,,"Closed autopatch, e-power, linked, remote base.",,,2016-08-10,Colorado Springs ARA,,,,,,CCARC,,,,,,,,,,,,,,,,,,,,,,,,,,,,,,,,,,,,,,,,,,,,,,,,,,,,
