Frequency,Offset,Tone,Call,Location,ST/PR,Use,VOIP,DGTL,Mi,Dir,,state_id,ID,Latitude,Longitude,Downlink,Uplink,Uplink Tone,Downlink Tone,YSF Digital Enabled,DG-ID,WIRES-X,County,Grid,Op Status,Coverage,Affiliate,Features,Mixed-Mode,Notes,Last update,Sponsor,Links,EchoLink,IRLP,Nets,Web links,Coordination,Bandwidth,AllStar,Feed,DMR Enabled,Color Code,DMR ID,IPSC Network,Wide Network,Talkgroups,Rocky Mountain Wide,Southern Colorado,On-air,Commands,Local/Cluster,Central Regional,Colorado,REACT,CO-Park County,D-STAR Enabled,Node,Sources,TAC 310,TAC 311,Colorado Chat,Eastern Colorado,P-25 Digital Enabled,NAC,Default Reflector,NXDN Enabled,RAN,NXDN Bandwidth,NXDN Network,Location Photo,Devilshead Local,Local Network,Northern Colorado Regional,Talkgroup Network,RX Location,Gunbarrel,Lousville,Lyons,Louisville #2,Worldwide,North America,English,DCI Bridge,Texas,COMM 1,Texas/Oklahoma Regional USA,N. Colorado,Mountain Reg USA,Worldwide English
444.6,5,146.2,WA0VJR,Wallace,KS,OPEN,I,,123.51,E,,20,3559,38.91389847,-101.59400177,444.6,449.6,146.2,,,,,Wallace,DM98EV,On-Air,US-40 Repeater Coverage Map,,,,Dial 9335 to access K-Link,2019-03-27,WA0VJR,,,3148,,,,,,,,,,,,,,,,,,,,,,,,,,,,,,,,,,,,,,,,,,,,,,,,,,,,,,,
146.985,-0.6,156.7,N0OMC,Lakin,KS,OPEN,,,124.26,ESE,,20,3967,37.93579865,-101.26399994,146.985,146.385,156.7,156.7,,,,Kearney,DM97IW,On-Air,"Kearny, Finney and Scott Counties",,E-power,,Linked full time to the Garden City 146.910 and Scott City 146.700 repeaters,2018-09-16,N0OMC,,,,,,Kansas Repeater Council,,,,,,,,,,,,,,,,,,,,,,,,,,,,,,,,,,,,,,,,,,,,,,,,,,,,
446.9,-5,,K0PRA,Parker,CO,OPEN,W,Y,124.62,NNW,,08,18248,39.51860046,-104.76100159,446.9,441.9,,,yes,Open ↑ / Open ↓,40895,Arapahoe,,On-Air,Small coverage area in Parker,,Linked to the Colorado Mega digital system,,,2019-11-03,Parker Radio Association,,,,Monday nights 8pm mountain,https://www.parkerradio.org,,,,,,,,,,,,,,,,,,,,,,,,,,,,,,,,,,,,,,,,,,,,,,,,,,,,,
448.05,-5,CC,N0KEG,Parker,CO,OPEN,,D,124.62,NNW,,08,17696,39.51860046,-104.76100159,448.05,443.05,,,,,,Douglas,,,,,,,,2019-11-27,,,,,,,,,,,yes,1,310374,Brandmeister c Record retrieved from radioid.net,BrandMeister,,,,Unknown,,,,,,,,,,,,,,,,,,,,,,,Brandmeister,,,,,,,,,,,,,,,,,
447.525,-5,203.5,N0ESQ,"Parker, Hess Reservoir",CO,OPEN,,,125.39,NNW,,08,8189,39.49420166,-104.83599854,447.525,442.525,203.5,146.2,,,,Douglas,DM79NL,On-Air,"Denver metropolitan area, front range foothills",Colorado ARES,,,"Not a ragchew machine. Traffic related to ARES, RACES and administrative and exercise traffic related thereto.",2017-03-11,EmComm Colorado,,,,,,CCARC,,,,,,,,,,,,,,,,,,,,,,,,,,,,,,,,,,,,,,,,,,,,,,,,,,,,
145.21,-0.6,110.9,N5GDR,Maxwell,NM,OPEN,A,,126.62,SW,,35,16113,36.50999832,-104.91000366,145.21,144.61,110.9,110.9,,,,Colfax,,On-Air,,,,,,2020-01-25,"Gary Reynolds N5GDR, Dale Finley KB5NFT",,,,,,,,46298,,,,,,,,,,,,,,,,,,,,,,,,,,,,,,,,,,,,,,,,,,,,,,,,,,
444.525,5,141.3,K0ECT,"Ulysses, Wagon Bed Springs",KS,OPEN,,,127.4,SE,,20,4110,37.403,-101.333,444.525,449.525,141.3,141.3,,,,Grant,,On-Air,,,E-power.,,,2019-05-07,SKECT,Full-time to the SKECT System .,,,,http://skect.org/default.aspx,Kansas Repeater Council,,,,,,,,,,,,,,,,,,,,,,,,,,,,,,,,,,,,,,,,,,,,,,,,,,,,
448.7,-5,146.2,WQ8M,Parker,CO,OPEN,,,127.86,NNW,,08,274,39.55799866,-104.79399872,448.7,443.7,146.2,,,,,Douglas,,On-Air,Local North Parker only,,,,,2018-09-07,,,,,,,,,,,,,,,,,,,,,,,,,,,,,,,,,,,,,,,,,,,,,,,,,,,,,,,,,,,
145.25,-0.6,123,KF5PFO,"Red River, Valle Vidal",NM,OPEN,,,128.72,SW,,35,15618,36.75999832,-105.30999756,145.25,144.65,123,,,,,Taos,DM76IS,On-Air,,,,,,2017-08-27,Taos ARC,,,,,Taos Amateur Radio Club,NMFCC,,,,,,,,,,,,,,,,,,,,,,,,,,,,,,,,,,,,,,,,,,,,,,,,,,,,
145.4,-0.6,100,KB0UDD,"Aurora, Smoky Hill",CO,OPEN,,,129.31,NNW,,08,5,39.6072998,-104.74099731,145.4,144.8,100,,,,,Arapahoe,,On-Air,Greater Denver area.,,"Autopatch, e-power.",,,2019-03-09,Castle Rock Repeater Group,"Full-time to 448.50000 (KB0UDD) at Aurora, Smokey Hill, CO .",,,,,CCARC,,,,,,,,,,,,,,,,,,,,,,,,,,,,,,,,,,,,,,,,,,,,,,,,,,,,
147.36,0.6,107.2,KC0CVU,"Lake George, Badger Mountain",CO,OPEN,I,,129.32,NW,,08,170,39.0489,-105.512,147.36,147.96,107.2,107.2,,,,Park,,On-Air,Wide area.,,E-power.,,,2018-01-15,,,,3854,,CMRG Repeaters,CCARC,,,,,,,,,,,,,,,,,,,,,,,,,,,,,,,,,,,,,,,,,,,,,,,,,,,,
146.685,-0.6,107.2,NX0G,"Lake George, Badger Mountain",CO,OPEN,,,129.38,NW,,08,169,39.04940033,-105.51300049,146.685,146.085,107.2,107.2,,,,Park,DM79FB,On-Air,,,"Closed autopatch, e-power.",,,2016-11-17,Mountain ARC (MARC),"Full-time to 146.82000 (NX0G) at Woodland Park, CO . Full-time to 448.65000 (NX0G) at Woodland Park, CO . Full-time to 447.47500 (NX0G) at Colorado Springs, CO . Full-time to 147.01500 (NX0G) at Cripple Creek, CO .",,,MARC/PCRC: Tue at 19:30.,,CCARC,,,,,,,,,,,,,Autopatch: 911,,,,,,,,,,,,,,,,,,,,,,,,,,,,,,,,,,,,,,,
145.19,-0.6,151.4,N0OBA,Aurora,CO,OPEN,E,,131,NNW,ON - IDLE,08,8741,39.62799835,-104.75800323,145.19,144.59,151.4,131.8,,,,Arapahoe,DM79OP,On-Air,"Aurora, Littleton, Denver, Morrison, North Colorado Springs to as far as Ft. Collins.",,Autopatch (please contact trustee).,,"Please note the PL's! Do not TSQ unless your radio can do split PL's. Otherwise you will not here the system. Regards, Scott",2018-02-01,N0OBA,,10079,,"""Tri Lakes Net"" This net is held every Monday at 7:30pm local (except on the third Monday of the month when we have our regular radio club meeting.)",,,,,,,,,,,,,,,,,,,,,,,,,,,,,,,,,,,,,,,,,,,,,,,,,,,,,,
147.315,0.6,CC,N0KEG,Centennial,CO,OPEN,,DS,131.57,NNW,"Colorado Mega Reflector - XLX376 Transcoder - YSF 23160 - WiresX 40895 Welcome to the new and improved Colorado Mega Link! Brought to you by the Parker Radio Association, where we have fun, play radio and keep the squelch loose. Please join us Monday nights at 8pm mountain time our our digital net.",08,17676,39.58069992,-104.8769989,147.315,147.915,,,,,,Arapahoe,,,"Southeast metro Denver area. Parker, Centennial, SE Aurora, Elizabeth, Franktown, Castle Rock.",Parker Radio Association,,,,2019-11-27,N0KEG,,,,Monday 8pm. Colorado Link Digital Net. Repeater is used in DSTAR mode for this net.,https://www.parkerradio.org,,,,,yes,1,310759,Brandmeister c Record retrieved from radioid.net,,,,,Unknown,,,,,,,yes,N0KEG (C) Repeater,jfindu lookup / dstar-users lookup,,,,,,,,,,,,,,,,,,,,,,,,,,,,,,,
146.61,-0.6,123,W0QS,Hugoton,KS,OPEN,,,132.55,SE,,20,18554,37.1753006,-101.34960175,146.61,146.01,123,123,,,,Graham,,On-Air,,,,,,2020-03-01,,,,,,,,,,,,,,,,,,,,,,,,,,,,,,,,,,,,,,,,,,,,,,,,,,,,,,,,,,,
147.04,0.6,141.3,NM5EM,"Eagle Nest, Touch Me Not",NM,OPEN,,,133.11,SW,,35,15635,36.57799911,-105.19799805,147.04,147.64,141.3,,,,,Colfax,DM76JN,On-Air,,,,,,2017-01-24,NMEMA ARC,,,,,,NMFCC,,,,,,,,,,,,,,,,,,,,,,,,,,,,,,,,,,,,,,,,,,,,,,,,,,,,
444.35,5,100,NM5ML,"Eagle Nest, Iron Mountain",NM,OPEN,,,133.98,SW,,35,77,36.59999847,-105.25,444.35,449.35,100,,,,,Colfax,DM76JO,On-Air,,,,,11,2018-01-07,,Full-time to the Mega-Link System .,,,,,NMFCC,,,,,,,,,,,,,,,,,,,,,,,,,,,,,,,,,,,,,,,,,,,,,,,,,,,,
146.88,-0.6,100,N0PUF,"Centennial, Warren Mountain",CO,OPEN,,,135.3,NW,,08,80,39.50419998,-105.12799835,146.88,146.28,100,,,,,Jefferson,,On-Air,Wide Area,,E-power.,,6,2020-03-13,Denver Radio League,,,,,DRL Repeaters,CCARC,,,,,,,,,,,,,,,,,,,,,,,,,,,,,,,,,,,,,,,,,,,,,,,,,,,,
449.6,-5,100,N0PUF,"Centennial, Warren Mountain",CO,OPEN,EI,Y,135.3,NW,Node Offline,08,273,39.50419998,-105.12799835,449.6,444.6,,,yes,Open ↑ / Open ↓,,Jefferson,,On-Air,,,,,,2020-03-13,Denver Radio League,,690473,3345,,DRL Repeaters,CCARC,,,,,,,,,,,,,,,,,,,,,,,,,,,,,,,,,,,,,,,,,,,,,,,,,,,,
447.5,-5,88.5,N0OWY,"Conifer, Critchell Mountain",CO,OPEN,,,135.94,NW,,08,60,39.4703,-105.198,447.5,442.5,88.5,88.5,,,,Jefferson,,On-Air,Wide area.,,E-power.,,,2014-04-28,Aurora Repeater Association,,,,,,CCARC,,,,,,,,,,,,,,,,,,,,,,,,,,,,,,,,,,,,,,,,,,,,,,,,,,,,
449.15,-5,136.5,WR0AEN,Aurora,CO,OPEN,,S,136.49,NNW,,08,8207,39.69670105,-104.80999756,449.15,444.15,,,,,,Arapahoe,,On-Air,,,,,,2012-11-12,Colorado Amateur Repeater Network (CARN),,,,,,CCARC,,,,,,,,,,,,,,,,,,,yes,WR0AEN (B),jfindu lookup / dstar-users lookup,,,,,,,,,,,,,,,,,,,,,,,,,,,,,,,
927.8625,-25.8,,WA6IFI,"Salida, Methodist Mountain",CO,OPEN,,,137.62,WNW,,08,18425,38.44670105,-106.01000214,927.8625,902.025,,,,,,Chaffee,,On-Air,"Wide area coverage, I 25 from Cheyenne south to MM 20 just north of Trinidad. I 76 East to MM 100. I 70 from Idaho Springs to Genoa. Highway 24 from the Colorado Springs to Limon. Highway 24 west of Colorado Springs is spotty to Hartsel. US 50 from Canon City to Las Animas. Salida south to the San Luis Valley to Antonito. Salida North to just south of Leadville. Repeater Coverage Map",,,,,2020-01-01,CMRG,Full-time to the The 900 P25 Network System .,,,,,CCARC,,,,,,,,,,,,,,,,,,,,,,,,,,yes,,yes,,,,,,,,,,,,,,,,,,,,,,,,
449.975,-5,100,K0JSC,"Salida, Methodist Mountain",CO,OPEN,EIA,,137.67,WNW,ON - IDLE,08,13510,38.4463,-106.011,449.975,444.975,100,100,,,,Chaffee,DM68xk,On-Air,I-25 from Walsenburg to Wyoming and US-50 from La junta to Monarch Pass,,2,,Can be linked to various local repeater systems via the remote base. Echolink/IRLP connects restricted. Email me to be added to the authorized list.,2017-03-11,,Full-time to the The Fun Machine System .,363976,7301,APRS Net: Sun at 19:00. Region 5 District 2 ARES Net: Sun at 19:30. Statewide ARES Net: Sun at 20:00. Region 5 District 1 ARES Net: Mon at 19:00. RGARC Net: Wed at 19:00.,K0JSC.COM,CCARC,,28368,,,,,,,,,,,,,,,,,,,,,,,,,,,,,,,,,,,,,,,,,,,,,,,,,,
147.285,0.6,88.5,KB0VJJ,"Salida, Methodist Mountain",CO,OPEN,,,137.87,WNW,,08,204,38.4596,-106.011,147.285,147.885,88.5,123,,,,Chaffee,,On-Air,"Wide area: South Park, Gunnison, Pueblo, and the San Luis Valley south to New Mexico. At extremes, it has been worked from east of Montrose and Blue Mesa Resevoir, on Fremont Pass near Climax, in and around Bailey on U.S. 285, and south toward Trinidad on Interstate 25.",,11,,,2016-05-23,Colorado Connection,Full-time to the Colorado Connection System .,,,Central Colorado Traffic Net: Daily at 19:30. Colorado Connection Net (All Welcome): Thu at 20:00. Statewide ARES Net: Sun at 20:00.,,CCARC,,,,,,,,,,,,,,,,,,,,,,,,,,,,,,,,,,,,,,,,,,,,,,,,,,,,
145.295,-0.6,107.2,KC0CVU,"Salida, Methodist Mountain",CO,OPEN,,,137.87,WNW,,08,203,38.4596,-106.011,145.295,144.695,107.2,,,,,Chaffee,DM78ik,On-Air,Wide area.,,,,,2019-08-15,Cheyenne Mtn Repeater Group,,,,,CMRG Repeaters,CCARC,,,,,,,,,,,,,,,,,,,,,,,,,,,,,,,,,,,,,,,,,,,,,,,,,,,,
449.65,-5,107.2,KC0CVU,"Salida, Methodist Mountain",CO,OPEN,,,138.14,WNW,,08,205,38.4528,-106.018,449.65,444.65,107.2,,,,,Chaffee,,On-Air,Wide area.,,E-power.,,,2018-01-15,,,,,,CMRG Repeaters,CCARC,,,,,,,,,,,,,,,,,,,,,,,,,,,,,,,,,,,,,,,,,,,,,,,,,,,,
449.925,-5,103.5,WZ0N,"Salida, Methodist Mountain",CO,OPEN,,,138.14,WNW,,08,3811,38.4528,-106.018,449.925,444.925,103.5,103.5,,,,Chaffee,,On-Air,"Upper Arkansas and Platte Rivers, and the SLV",Colorado ARES,E-power (Bat),,Identifies with an 'M' following WZ0N callsign which identifies the site as Methodist.,2013-07-05,,,,,,,CCARC,,,,,,,,,,,,,,,,,,,,,,,,,,,,,,,,,,,,,,,,,,,,,,,,,,,,
147.06,0.6,,K0ECT,Ulysses,KS,OPEN,,,138.29,SE,,20,3979,37.24000168,-101.1989975,147.06,147.66,,,,,,Grant,DM97JF,On-Air,Local,,,,,2019-10-18,SKECT,,,,,,Kansas Repeater Council,,,,,,,,,,,,,,,,,,,,,,,,,,,,,,,,,,,,,,,,,,,,,,,,,,,,
446.975,-5,,KD0QPG,"Salida, Methodist Mountain",CO,OPEN,,S,138.5,WNW,,08,9844,38.5347,-105.999,446.975,441.975,,,,,,Chaffee,,On-Air,,Crestone Amateur Radio Emergency Services,,,,2013-07-06,Crestone Amateur Radio Emergency Services,,,,,KD0QPG,CCARC,,,,,,,,,,,,,,,,,,,yes,KD0QPG (B) Gateway Repeater,jfindu lookup / dstar-users lookup,,,,,,,,,,,,,,,,,,,,,,,,,,,,,,,
446.8125,-5,CC,N0SZ,"Salida, Methodist Mountain",CO,OPEN,,D,138.5,WNW,,08,12697,38.53469849,-105.99900055,446.8125,441.8125,,,,,,Chaffee,,On-Air,,,,,,2019-11-27,RMHAM,,,,,,,,,,yes,7,310825,RMHR c Record retrieved from radioid.net,,"Open Talkgroup View Assignment TS TG Access Rocky Mountain Wide 1 700 Southern Colorado 2 719 function myFunction(id) { var x = document.getElementById(id); if (x.className.indexOf(""w3-show"") == -1) { x.className += "" w3-show""; } else { x.className = x.className.replace("" w3-show"", """"); } }",1,2,,,,,,,,,,,,,,,,,,,,,,,,,,,,,,,,,,,,,,,,,
448.5,-5,100,KB0UDD,"Aurora, Smokey Hill",CO,OPEN,,,139.01,NNW,,08,92,39.72940063,-104.83100128,448.5,443.5,100,,,,,Denver,,On-Air,Greater Denver area.,,E-power.,,,2017-03-11,Castle Rock Repeater Group,"Full-time to 145.40000 (KB0UDD) at Aurora, Smoky Hill, CO .",,,,,CCARC,,,,,,,,,,,,,,,,,,,,,,,,,,,,,,,,,,,,,,,,,,,,,,,,,,,,
448.4,-5,94.8,N0ZUQ,Aurora,CO,OPEN,,,139.03,NNW,,08,8202,39.72940063,-104.83200073,448.4,443.4,94.8,,,,,Arapahoe,,On-Air,,,,,,2012-11-12,,,,,,,CCARC,,,,,,,,,,,,,,,,,,,,,,,,,,,,,,,,,,,,,,,,,,,,,,,,,,,,
448.275,-5,156.7,W0BG,Aurora,CO,OPEN,,,139.03,NNW,,08,8199,39.72940063,-104.83200073,448.275,443.275,156.7,,,,,Arapahoe,,On-Air,,,,,,2013-01-05,W0BG,,,,,,CCARC,,,,,,,,,,,,,,,,,,,,,,,,,,,,,,,,,,,,,,,,,,,,,,,,,,,,
449.95,-5,77,W9SL,Aurora,CO,OPEN,,,139.03,NNW,,08,8743,39.72940063,-104.83200073,449.95,444.95,77,77,,,,Arapahoe,,On-Air,Primarily to the North along I-25 corridor,,,,,2019-08-23,W9SL Owner,,,,,,CCARC,,,,,,,,,,,,,,,,,,,,,,,,,,,,,,,,,,,,,,,,,,,,,,,,,,,,
448.825,-5,,WN7ANT,Aurora,CO,OPEN,W,Y,139.03,NNW,,08,16032,39.72940063,-104.83200073,448.825,443.825,,,yes,Open ↑ / Open ↓,30584,Arapahoe,,On-Air,,,,,,2017-12-13,,,,,,,,,,,,,,,,,,,,,,,,,,,,,,,,,,,,,,,,,,,,,,,,,,,,,,,,,,,
145.39,-0.6,100,KF5PFO,"Red River, Molycorp",NM,OPEN,,,140.29,SW,,35,137,36.69300079,-105.51399994,145.39,144.79,100,,,,,Taos,DM76FQ,On-Air,Wide area.,,"E-power, linked.",,,2017-09-01,Taos ARC,,,,,Taos Amateur Radio Club,NMFCC,,,,,,,,,,,,,,,,,,,,,,,,,,,,,,,,,,,,,,,,,,,,,,,,,,,,
146.64,-0.6,77,N0KM,Center,CO,OPEN,A,,140.82,W,,08,14200,37.7531,-106.109,146.64,146.04,77,77,,,,Rio Grande,,On-Air,Low level local coverage,,,,,2016-12-25,,,,,,,,,28781,,,,,,,,,,,,,,,,,,,,,,,,,,,,,,,,,,,,,,,,,,,,,,,,,,
448.15,-5,141.3,WE0FUN,"Denver, Green Valley Ranch",CO,OPEN,EA,,140.94,NNW,Node Offline,08,9765,39.79669952,-104.7480011,448.15,443.15,141.3,141.3,,,,Denver,DM79pt,On-Air,Small coverage of the East Denver area SW of DIA. Repeater Coverage Map,,E-power (batt). 2 meter and 70cm channel steerable remote bases.,,Can be linked to various local repeater systems via the remote base(s). Echolink connects restricted. Email me to be added to the authorized list. The system may be occupied in the Southern Colorado area for a formal net or ARES activity.,2019-08-22,K0GUR,Full-time to the The Fun Machine System .,24340,,APRS Net: Sun at 19:00. Region 5 District 2 ARES Net: Sun at 19:30. Statewide ARES Net: Sun at 20:00. Region 5 District 1 ARES Net: Mon at 19:00. RGARC Net: Wed at 19:00.,k0jsc.com,CCARC,,29436,Listen Live,,,,,,,,,,,,,,,,,,,,,,,,,,,,,,,,,,,,,,,,,,,,,,,,,
447.1,-5,77,N0KM,Center,CO,OPEN,,,141.17,W,,08,16645,37.75,-106.115,447.1,442.1,77,,,,,Saguache,,On-Air,,,,,,2017-12-13,,,,,,,,,,,,,,,,,,,,,,,,,,,,,,,,,,,,,,,,,,,,,,,,,,,,,,,,,,,
147.14,0.6,67,NM5ML,"Taos, Ski Valley",NM,OPEN,,,141.8,SW,,35,11288,36.59780121,-105.44499969,147.14,147.74,67,,,,,Taos,,On-Air,,TaosARC,11,,,2017-07-25,,Full-time to the Mega-Link System .,,,,http://www.taosarc.com/,,,,,,,,,,,,,,,,,,,,,,,,,,,,,,,,,,,,,,,,,,,,,,,,,,,,,
444.975,5,88.5,N5DFQ,Guymon,OK,OPEN,,,142.2,SE,,40,4419,36.6758,-101.547,444.975,449.975,88.5,,,,,Texas,,On-Air,30,,Linked.,,,2014-07-07,DBARC,,,,,http://caprockintertie.org/,ORSI,,,,,,,,,,,,,,,,,,,,,,,,,,,,,,,,,,,,,,,,,,,,,,,,,,,,
1287.9,-20,CSQ,W0CRA,"Conifer, Conifer Mountain",CO,OPEN,,,142.37,NW,,08,103,39.5211,-105.305,1287.9,1267.9,CSQ,,,,,Jefferson,,Off-Air,Fort Collins to Colorado Springs.,,,,,2017-10-07,Colorado Repeater Association (CRA),,,,,,CCARC,,,,,,,,,,,,,,,,,,,,,,,,,,,,,,,,,,,,,,,,,,,,,,,,,,,,
444.975,5,123,N5TSV,"Taos, Wheeler Peak",NM,OPEN,,,142.6,SW,,35,183,36.55670166,-105.41600037,444.975,449.975,123,,,,,Taos,DM76HN,On-Air,,,,,,2017-02-13,N5TSV,,,,,,NMFCC,,,,,,,,,,,,,,,,,,,,,,,,,,,,,,,,,,,,,,,,,,,,,,,,,,,,
146.895,-0.6,100,AB0PC,"Bailey, Dick Mountain",CO,OPEN,A,,143.02,NW,,08,7,39.4056,-105.473,146.895,146.295,100,100,,,,Park,,On-Air,285,,25,,,2017-07-05,AB0RR,"Full-time internet linked to 448.57500 (WZ0N) at Hartsel, CO .",,,Wed at 19:30.,Park County Radio Club (PCRC),CCARC,,45835,,,,,,,,,,,,,,,,,,,,,,,,,,,,,,,,,,,,,,,,,,,,,,,,,,
927.9375,-25.9,,KI0HC,"Indian Hills, Chief Mtn",CO,OPEN,,,143.18,NW,,08,17457,39.6,-105.21,927.9375,902.025,,,,,,Jefferson,,On-Air,"Wide area,Denver,Colorado Springs, Pueblo, Loveland. I70 East of Denver to Genoa and I25 North to Loveland &amp; South to Aguilar. I76 East to Atwood",,linked to Centennial Cone 927.8375 &amp; Almagre 927.7250,,,2018-12-23,,,,,,,CCARC,,,,,,,,,,,,,,,,,,,,,,,,,,yes,293,yes,,,,,,,,,,,,,,,,,,,,,,,,
146.7,-0.6,141.3,WA0OQA,Scott City,KS,OPEN,A,Y,143.43,E,,20,3940,38.4846,-100.979,146.7,146.1,141.3,141.3,yes,Open ↑ / Open ↓,,Scott,DM98,On-Air,"Scott, Finney and Kearny counties",,E-power.,Yes; analog capable.,Comet GP-6 @ 125'.,2018-09-16,Sand Hills ARC,"Full-time to 146.91000 (WA0OQA) at Garden City, KS .",,,Tue at 20:30.,,Kansas Repeater Council,,48589,,,,,,,,,,,,,,,,,,,,,,,,,,,,,,,,,,,,,,,,,,,,,,,,,,
448.575,-5,103.5,WZ0N,Hartsel,CO,OPEN,,,143.43,WNW,,08,9840,38.88330078,-105.93299866,448.575,443.575,103.5,103.5,,,,Park,DM78AV,Off-Air,Western Park County,,,,,2017-11-22,,"Full-time internet linked to 146.89500 (AB0PC) at Bailey, Dick Mountain, CO .",,,,,CCARC,,,,,,,,,,,,,,,,,,,,,,,,,,,,,,,,,,,,,,,,,,,,,,,,,,,,
447.925,-5,100,K0FEZ,Denver,CO,OPEN,,,143.79,NNW,,08,8196,39.73759842,-104.98500061,447.925,442.925,100,100,,,,Denver,,On-Air,,,,,,2014-07-03,RADOPS El Jebel Shriners,,,,,,CCARC,,,,,,,,,,,,,,,,,,,,,,,,,,,,,,,,,,,,,,,,,,,,,,,,,,,,
147.12,0.6,88.5,N0ARA,"Critchell, Critchell Mountain",CO,OPEN,,,143.79,NW,,08,59,39.5148,-105.353,147.12,147.72,88.5,88.5,,,,Jefferson,,On-Air,Denver metro and east.,,E-power.,,,2016-01-17,Aurora Repeater Association,,,,,http://www.n0ara.org,CCARC,,,,,,,,,,,,,,,,,,,,,,,,,,,,,,,,,,,,,,,,,,,,,,,,,,,,
447.9,-5,CSQ,WB0TPT,Denver,CO,OPEN,,,143.79,NNW,,08,8195,39.73759842,-104.98500061,447.9,442.9,CSQ,,,,,Denver,,Off-Air,,,,,,2017-03-11,WB0TPT,,,,,,CCARC,,,,,,,,,,,,,,,,,,,,,,,,,,,,,,,,,,,,,,,,,,,,,,,,,,,,
449.65,-5,136.5,WR0AEN,Denver,CO,OPEN,,S,143.79,NNW,,08,8212,39.73759842,-104.98500061,449.65,444.65,,,,,,Denver,,On-Air,,,,,,2012-11-16,Colorado Amateur Repeater Network (CARN),,,,,,CCARC,,,,,,,,,,,,,,,,,,,yes,WR0AEN (B),jfindu lookup / dstar-users lookup,,,,,,,,,,,,,,,,,,,,,,,,,,,,,,,
449.675,-5,136.5,WR0AEN,Denver,CO,OPEN,I,S,143.79,NNW,,08,8213,39.73759842,-104.98500061,449.675,444.675,,,,,,Denver,,On-Air,,,,,,2012-11-16,Colorado Amateur Repeater Network (CARN),,,7708,,,CCARC,,,,,,,,,,,,,,,,,,,yes,WR0AEN (B),jfindu lookup / dstar-users lookup,,,,,,,,,,,,,,,,,,,,,,,,,,,,,,,
145.475,-0.6,100,KE0SJ,"Boulder, Blue Mountain",CO,OPEN,,,143.85,NNW,,08,75,39.73920059,-104.98400116,145.475,144.875,100,,,,,Jefferson,,On-Air,"Wide Area: Ft. Collins to the North, Colorado Springs to the South, Parts of Akron to the east.",,E-power.,,,2015-05-22,Intermountain Repeater Group,,,,,Intermountain Repeater Group,CCARC,,,,,,,,,,,,,,,,,,,,,,,,,,,,,,,,,,,,,,,,,,,,,,,,,,,,
146.715,-0.6,123,N0JXN,Denver,CO,OPEN,,,143.85,NNW,,08,79,39.73920059,-104.98400116,146.715,146.115,123,123,,,,Denver,,On-Air,,,E-power.,,,2017-04-09,EARS,,,,,,CCARC,,,,,,,,,,,,,,,,,,,,,,,,,,,,,,,,,,,,,,,,,,,,,,,,,,,,
448.075,-5,123,N5EHP,Denver,CO,OPEN,,,143.85,NNW,,08,91,39.73920059,-104.98400116,448.075,443.075,123,,,,,Denver,,On-Air,,,,,,2017-03-11,W0IG,,,,,,CCARC,,,,,,,,,,,,,,,,,,,,,,,,,,,,,,,,,,,,,,,,,,,,,,,,,,,,
448.55,-5,82.5,W0KIZ,Denver,CO,OPEN,,,143.85,NNW,,08,93,39.73920059,-104.98400116,448.55,443.55,82.5,,,,,Denver,,Off-Air,,,E-power.,,,2017-03-11,HPRA,,,,,,CCARC,,,,,,,,,,,,,,,,,,,,,,,,,,,,,,,,,,,,,,,,,,,,,,,,,,,,
449.625,-5,94.8,K0SLV,Monte Vista,CO,OPEN,,,143.92,W,,08,18580,37.58418274,-106.13030243,449.625,444.625,94.8,,,,,Rio Grande,,On-Air,,,Emergency Power,,,2020-03-11,S.A.R.A.,,,,,http://K0SLV.COM,,,,,,,,,,,,,,,,,,,,,,,,,,,,,,,,,,,,,,,,,,,,,,,,,,,,,
147.15,0.6,88.5,N5DFQ,Guymon,OK,OPEN,,,144.67,SE,,40,4418,36.68280029,-101.48200226,147.15,147.75,88.5,,,,,Texas,,On-Air,,,"Linked, WX.",,,2014-01-27,DBARC,Full-time to the Caprock Intertie System .,,,,http://caprockintertie.org/,ORSI,,,,,,,,,,,,,,,,,,,,,,,,,,,,,,,,,,,,,,,,,,,,,,,,,,,,
447.175,-5,100,W0JRL,"Denver, Broadway Plaza Lofts",CO,OPEN,EA,,144.87,NNW,ON - IDLE,08,12216,39.75519943,-104.98699951,447.175,442.175,100,100,,,,Denver,DM79MS,On-Air,,,,,,2015-05-15,W0JRL,,201712,,,,CCARC,,29997,,,,,,,,,,,Standard AllStar Link access commands.,,,,,,,,,,,,,,,,,,,,,,,,,,,,,,,,,,,,,,,
147.34,0.6,100,N5LEM,"Angel Fire, Agua Fria Peak",NM,OPEN,,,144.98,SW,,35,41,36.36000061,-105.20999908,147.34,147.94,100,,,,,Colfax,DM76JI,On-Air,Wide area.,,E-power.,,,2017-08-27,Taos ARC,,,,,Taos Amateur Radio Club,NMFCC,,,,,,,,,,,,,,,,,,,,,,,,,,,,,,,,,,,,,,,,,,,,,,,,,,,,
147.33,0.6,100,W0TX,"Lakewood, Green Mountain",CO,OPEN,,,145.46,NW,,08,85,39.68220139,-105.14299774,147.33,147.93,100,,,,,Jefferson,,On-Air,Metro Denver and the foothills.,,E-power.,,Not recommeded to use tone squelch on this repeater.,2017-03-31,Denver Radio Club,,,,SATERN: Thu at 19:30.,DRC Repeaters,CCARC,,,,,,,,,,,,,,,,,,,,,,,,,,,,,,,,,,,,,,,,,,,,,,,,,,,,
224.38,-1.6,100,W0TX,"Lakewood, Green Mountain",CO,OPEN,,,145.46,NW,,08,267,39.68220139,-105.14299774,224.38,222.78,100,100,,,,Jefferson,,On-Air,,,,,,2017-03-11,Denver Radio Club,,,,,DRC Repeaters,CCARC,,,,,,,,,,,,,,,,,,,,,,,,,,,,,,,,,,,,,,,,,,,,,,,,,,,,
449.775,-5,CSQ,W0TX,"Lakewood, Green Mtn",CO,OPEN,,Y,145.46,NW,,08,8215,39.68220139,-105.14299774,449.775,444.775,,,yes,Open ↑ / Open ↓,,Jefferson,DM79KQ,On-Air,Metro Denver,,Yaesu Digital Only,,"YSF digital only, no analog FM",2019-09-06,Denver Radio Club,,,,,Denver Radio Club,CCARC,,,,,,,,,,,,,,,,,,,,,,,,,,,,,,,,,,,,,,,,,,,,,,,,,,,,
146.91,-0.6,141.3,WA0OQA,Garden City,KS,OPEN,A,,145.48,ESE,,20,3959,37.9717,-100.873,146.91,146.31,141.3,141.3,,,,Finney,,On-Air,"Finney, Scott and Kearney counties.",,E-power.,,Linked full time to Scott City 146.700 and Lakin 146.985 repeaters.,2018-09-16,Sand Hills ARC,"Full-time to 146.70000 (WA0OQA) at Scott City, KS .",,,Tue at 20:30.,,Kansas Repeater Council,,48588,,,,,,,,,,,,,,,,,,,,,,,,,,,,,,,,,,,,,,,,,,,,,,,,,,
446.7625,-5,CC,N0SZ,"Fairplay, Badger",CO,OPEN,,D,145.59,WNW,,08,12698,39.0469,-105.87,446.7625,441.7625,,,,,,Park,,On-Air,,RMHAM,,,,2017-03-11,K7PFJ,,,,,,,,,,yes,0,,,,"Open Talkgroup View Assignment TS TG Access Rocky Mountain Wide 1 700 Central Regional 2 720 function myFunction(id) { var x = document.getElementById(id); if (x.className.indexOf(""w3-show"") == -1) { x.className += "" w3-show""; } else { x.className = x.className.replace("" w3-show"", """"); } }",1,,,,,2,,,,,,,,,,,,,,,,,,,,,,,,,,,,,,,,,,,,,
448.75,-5,100,N0ELY,Lakewood,CO,OPEN,,,146.07,NW,,08,8204,39.70460129,-105.1230011,448.75,443.75,100,100,,,,Jefferson,DM79KQ,Off-Air,Local.,N0ELY,E-power.,,,2019-08-23,,,,,,,CCARC,,,,,,,,,,,,,,,,,,,,,,,,,,,,,,,,,,,,,,,,,,,,,,,,,,,,
444.95,5,100,W0MI,"Scott City, K-Link",KS,OPEN,,,146.27,E,,20,6463,38.48089981,-100.9240036,444.95,449.95,100,100,,,,Scott,DM98ML,Off-Air,Click for coverage map. 35 mi radius.,,Internet Linked to K-Link Repeater Network.,,,2019-07-27,SHARC,Full-time internet linked to the K-Link System .,,,,http://ks0lnk.net,Kansas Repeater Council,,,,,,,,,,,,,,,,,,,,,,,,,,,,,,,,,,,,,,,,,,,,,,,,,,,,
447.825,-5,D073,W0TX,"Lakewood, St Anthony Medical Campus",CO,OPEN,,,146.94,NW,,08,5805,39.71620178,-105.12999725,447.825,442.825,D073,,,,,Jefferson,DM79KR,On-Air,,,,,Now operating in Narrow Band mode with Digital Code Squelch. Please reset your programing to use: 12.5 KHz. bandwidth (+/- 2.5 KHz. deviation).,2017-03-11,Denver Radio Club,,,,,,CCARC,,,,,,,,,,,,,,,,,,,,,,,,,,,,,,,,,,,,,,,,,,,,,,,,,,,,
53.17,-0.5,107.2,N6LXX,"Morrison, Mt. Morrison",CO,OPEN,A,,147.4,NW,,08,10514,39.67340088,-105.21800232,53.17,52.67,107.2,,,,,Jefferson,,On-Air,"I-70,I-76,I-25,I-225",N6LXX,,,,2019-03-25,N6LXX,Full-time to the N6LXX System .,,,,,CCARC,,29883,,,,,,,,,,,,,,,,,,,,,,,,,,,,,,,,,,,,,,,,,,,,,,,,,,
447.875,-5,107.2,N6LXX,"Morrison, Mt. Morrison",CO,OPEN,A,,147.4,NW,,08,10513,39.67340088,-105.21800232,447.875,442.875,107.2,107.2,,,,Jefferson,,On-Air,"I-70,I-76,I-25,I-225",N6LXX,,,,2017-03-09,N6LXX,Full-time to the N6LXX System .,,,,,CCARC,,29913,,,,,,,,,,,,,,,,,,,,,,,,,,,,,,,,,,,,,,,,,,,,,,,,,,
53.09,-1.7,107.2,W0TX,"Lakewood, Green Mountain",CO,OPEN,,,147.6,NW,,08,105,39.70080185,-105.1780014,53.09,51.39,107.2,,,,,Jefferson,DM79JQ,On-Air,Metro Denver area.,,E-power.,,,2017-03-11,Denver Radio Club,,,,,DRC Repeaters,CCARC,,,,,,,,,,,,,,,,,,,,,,,,,,,,,,,,,,,,,,,,,,,,,,,,,,,,
145.34,-0.6,103.5,KE4GUQ,Evergreen,CO,OPEN,I,,148.6,NW,,08,73,39.6333,-105.317,145.34,144.74,103.5,127.3,,,,Jefferson,,On-Air,Wide area.,,E-power.,,,2019-08-15,Rocky Mtn Radio League,,,3350,,Repeater,CCARC,,,,,,,,,,,,,,,,,,,,,,,,,,,,,,,,,,,,,,,,,,,,,,,,,,,,
145.175,-0.6,CC,N0SZ,"Evergreen, Squaw Mountain",CO,OPEN,,D,148.6,NW,,08,10932,39.6333,-105.317,145.175,144.575,,,,,,Clear Creek,,On-Air,,,700,,Voice ID is required for data/GPS/text on TG 705,2018-11-25,Rocky Mountain Ham Radio,,,,,Rocky Mountain Ham Radio,CCARC,,,,yes,7,310810,,,,,,,,,,,,,,,,,,,,,,,,,,,,,,,,,,,,,,,,,,,,,,
147.21,0.6,100,KD0SSP,"Lakewood, Moffat Treatment Plant",CO,OPEN,I,,148.65,NW,,08,9775,39.75049973,-105.1230011,147.21,147.81,100,100,,,,Jefferson,DM79KS,On-Air,,,,Yes; analog capable.,,2020-01-23,Denver Water Amateur Radio Club,,,3241,,http://www.dwarc.com,,,,,,,,,,,,,,,,,,,,,,,,,,,,,,,,,,,,,,,,,,,,,,,,,,,,,
